-- phpMyAdmin SQL Dump
-- version 5.1.1
-- https://www.phpmyadmin.net/
--
-- Host: 127.0.0.1
-- Generation Time: Jun 21, 2022 at 01:09 AM
-- Server version: 10.4.22-MariaDB
-- PHP Version: 8.0.13

SET SQL_MODE = "NO_AUTO_VALUE_ON_ZERO";
START TRANSACTION;
SET time_zone = "+00:00";


/*!40101 SET @OLD_CHARACTER_SET_CLIENT=@@CHARACTER_SET_CLIENT */;
/*!40101 SET @OLD_CHARACTER_SET_RESULTS=@@CHARACTER_SET_RESULTS */;
/*!40101 SET @OLD_COLLATION_CONNECTION=@@COLLATION_CONNECTION */;
/*!40101 SET NAMES utf8mb4 */;

--
-- Database: `bscn-db`
--

-- --------------------------------------------------------

--
-- Table structure for table `subscriber_tbl`
--

CREATE TABLE `subscriber_tbl` (
  `uid_` int(11) NOT NULL,
  `stats` tinyint(1) NOT NULL DEFAULT 1,
  `LName` varchar(255) NOT NULL,
  `FName` varchar(255) NOT NULL,
  `MName` varchar(255) NOT NULL,
  `CNum` varchar(255) NOT NULL,
  `Address` varchar(255) NOT NULL,
  `IPAddr` varchar(255) NOT NULL,
  `MACAddr` varchar(255) NOT NULL,
  `SERIAL` varchar(255) NOT NULL,
  `NAP` varchar(255) NOT NULL,
  `SLOT` varchar(255) NOT NULL,
  `LCP` varchar(255) NOT NULL,
  `OLT` varchar(255) NOT NULL,
  `GPON` varchar(255) NOT NULL,
  `PLAN` varchar(255) NOT NULL,
  `DATE` varchar(255) NOT NULL,
  `Date_Installed` date NOT NULL DEFAULT current_timestamp(),
  `TYPE` varchar(255) NOT NULL,
  `LINEMAN` varchar(255) NOT NULL,
  `DISCONNECTED` varchar(255) NOT NULL,
  `RECONNECTED` varchar(255) NOT NULL,
  `WIRE` varchar(255) NOT NULL,
  `REMARKS` varchar(255) NOT NULL
) ENGINE=InnoDB DEFAULT CHARSET=utf8mb4;

--
-- Dumping data for table `subscriber_tbl`
--

INSERT INTO `subscriber_tbl` (`uid_`, `stats`, `LName`, `FName`, `MName`, `CNum`, `Address`, `IPAddr`, `MACAddr`, `SERIAL`, `NAP`, `SLOT`, `LCP`, `OLT`, `GPON`, `PLAN`, `DATE`, `Date_Installed`, `TYPE`, `LINEMAN`, `DISCONNECTED`, `RECONNECTED`, `WIRE`, `REMARKS`) VALUES
(1, 1, 'ESTIPULAR', 'BARRY', 'CRUZ', '0998-564-0268', '#120 B.O TOTO CUPANG PROPER', '172.16.6.152', '9845628B19E0', '247212870', '', '', '34', '2', 'GPON 8', '1500', '02/10/2020', '2020-02-10', 'NEW INSTALL INTERNET - DISCONNECTED CABLE', 'JAYSON/AIRON', '', '', '', 'barry.estipular.pnp@gmail.com'),
(2, 1, 'TUAZON', 'DANILO', 'LAREZA', '0917-306-2977', '# 160 B.O TOTO CUPANG PROPER', '172.16.255.252', '9845628B38B0', '247213363', '', '', '34', '2', 'GPON 8', '1250', '02/10/2020', '2020-02-10', 'NEW INSTALL CABLE INTERNET', 'JAYSON/AIRON', '', '', '', 'cpdo.danilo@gmail.com'),
(3, 1, 'DASIG', 'JOSE', 'DIZON', '0977-807-2249', '#22 PHASE 3 TALISAY', '172.16.174.156', '9845628B38C0', '247213364', 'NAP 4 / SLOT 1 1ST LAYER', 'NAP 4 / SLOT 1 1ST LAYER', '7', '1', 'GPON 7', '1250', '02/10/2020', '2020-02-10', 'NEW INSTALL CABLE INTERNET', 'JEFF/CRIS', '02/24/2022', '02/25/2022', '', 'jose.dasig@deped.gov.ph'),
(4, 1, 'DEPED TALISAY PHASE 3', 'DEPED TALISAY PHASE 3', 'DEPED TALISAY PHASE 3', '', 'PHASE 3 TALISAY DEPED', '172.16.174.128', '9845628B42D0', '247213525', '', '', '7', '1', 'GPON 7', '1500', '02/11/2020', '2020-02-11', 'NEW INSTALL CABLE INTERNET', 'JEFF/CRIS', '', '', '', ''),
(5, 1, 'REGENCIA', 'RODIAN', 'CAREL', '0928-693-2039', 'B.O TOTO CUPANG PROPER', '172.16.255.248', '9845628B4320', '247213530', '', '', '34', '2', 'GPON 8', '1500', '02/11/2020', '2020-02-11', 'NEW INSTALL CABLE INTERNET', 'JAYSON/AIRON', '09/28/2021', '09/29/2021', '', 'janellsofiya003@gmail.com'),
(6, 1, 'MADLANGBAYAN', 'EMMA', 'DIZON', '0908-5704709', 'STO.CRISTO CENTRAL CUPANG', '172.16.255.243', '9845628B4110', '247213497', '', '', '38', '2', 'GPON 12', '1250', '02/12/2020', '2020-02-12', 'NEW INSTALL CABLE INTERNET', 'JEFF/CRIS', '', '', '', ''),
(7, 1, 'PASCUAL', 'CRISTINA', 'MALIXI', '0939-598-0783', '#37 NAVAL ST. CUPANG NORTH', '172.16.255.244', '9845628B4C10', '247213673', '', '', '31', '2', 'GPON 5', '1000', '02/12/2020', '2020-02-12', 'NEW INSTALL CABLE INTERNET', 'JAYSON/AIRON', '01/25/2022', '02/02/2022', '', 'emceepascual21@gmail.com'),
(8, 1, 'LADERA', 'MARY ANN', 'MENDOZA', '0909-847-3057', '#120 STO.CRISTO CENTRAL CUPANG', '172.16.255.242', '9845628B4F60', '247213726', '', '', '38', '2', 'GPON 12', '1500', '02/12/2020', '2020-02-12', 'NEW INSTALL / INTERNET ONLY', 'JAYSON/AIRON', '04/25/2022', '04/25/2022', '', 'maryannladera1103@gmail.com'),
(9, 1, 'LACSA', 'IRISH MAE', 'EVANGELISTA', '0916-419-5830', 'PHASE 3 TALISAY', '172.16.255.241 / 172.16.5.32', '9845628B4690', '247213585', '', '', '7', '1', 'GPON 7', '1400', '02/13/2020', '2020-02-13', 'NEW INSTALL CABLE INTERNET', 'JEFF/AIRON', '', '', '', 'irishlacsa@outlook.com'),
(10, 1, 'ARASAS', 'MANUEL', 'LLADO', '0919-352-3840', '#111 B.O TOTO CUPANG PROPER', '172.16.255.239', '9845628B4810', '247213609', '', '', '29', '2', 'GPON 3', '1000', '02/13/2020', '2020-02-13', 'NEW INSTALL CABLE INTERNET', 'JAYSON/AIRON', '', '', '', ''),
(11, 1, 'VELASCO', 'JANICE KATHRYN', 'DEL MUNDO', '0918-375-6704', '#8 ST.ANNE CUPANG PROPER', '172.16.255.236', '9845628B3E90', '247213457', '', '', '35', '2', 'GPON 9', '1250', '02/14/2020', '2020-02-14', 'NEW INSTALL CABLE INTERNET', 'JAYSON/AIRON', '04/25/2022', '04/25/2022', '', 'jamella.velasco@gmail.com'),
(12, 1, 'GALVEZ', 'VINCENT', 'TAPIA', '0998-984-6580', 'LOT 12 BLK 51 MANNGA ST. DFS', '172.16.255.235', '9845628B4260', '247213518', '', '', '1', '1', 'GPON 1', '1500', '02/14/2020', '2020-02-14', 'NEW INSTALL CABLE INTERNET', 'JEFF/JOEY/JOJO', '', '', '', 'vtgalvez@netzer.com'),
(13, 1, 'DE LEON', 'EDUARDO', 'TUATIS', '0949-406-6528', '#1 KASSANDRA ST. ST.ANNE SUBD. CUPANG PROPER', '172.16.255.234', '9845628B3F30', '247213467', '', '', '35', '2', 'GPON 9', '1250', '02/14/2020', '2020-02-14', 'EXISTING CABLE UPGARADE TO FIBER', 'JAYSON/AIRON', '', '', '', 'edong795@gmail.com'),
(14, 1, 'SANTOS', 'ROSEMARIE', '', '0910-280-1634', '#286 BANZON ST. CENTRAL CUPANG', '172.16.255.240', '9845628B3FC0', '247213476', '', '', '40', '2', 'GPON 14', '1500', '02/15/2020', '2020-02-15', 'NEW INSTALL CABLE INTERNET', 'JEFF/JOEY', '', '', '', 'DISCONNECT CABLE 04/30/2022'),
(15, 1, 'AMADO', 'CRISTINE', 'SANCHEZ', '0998-556-7829', '#131 B.O TOTO CUPANG PROPER', '172.16.255.232', '9845628B40B0', '247213491', '', '', '34', '2', 'GPON 8', '1250', '02/15/2020', '2020-02-15', 'NEW INSTALL CABLE INTERNET', 'JAYSON/AIRON', '04/25/2022', '04/25/2022', '', 'cssandraa.amado16@yahoo.com'),
(16, 1, 'TUAZON', 'CHARITO', 'SANCHEZ', '0929-251-5085', '#130 B.O TOTO CUPANG PROPER', '172.16.255.233', '9845628B4D30', '247213691', '', '', '34', '2', 'GPON 8', '1250', '02/15/2020', '2020-02-15', 'NEW INSTALL CABLE INTERNET', 'JAYSON/AIRON', '', '', '', 'charito.tuazon@deped.gov.ph'),
(17, 1, 'SANTOS', 'KATHERINE ANNE', 'DEL MUNDO', '0912-860-0271', '#1 3RD ST. MARIA LOURDES CUPANG PORPER', '172.16.255.229', '9845628B4A30', '247213643', '', '', '38', '2', 'GPON 12', '1500', '02/18/2020', '2020-02-18', 'NEW INSTALL CABLE INTERNET / UPGRADE TO 30MBPS DISCONNECT CABLE 08/19/2021', 'JEFF/JOEY/ERICK', '04/25/2022', '04/25/2022', '', 'katherineannesantos06@gmail.com'),
(18, 1, 'MEDRANO', 'SHAYNE', 'DE GUZMAN', '0908-623-9200', 'DOOR 2 BALBUENA APT. SILVERLAND CUPANG', '172.16.255.228', '9845628B13B0', '247206290', '', '', '36', '1', 'GPON 11', '1500', '02/18/2020', '2020-02-18', 'NEW INSTALL CABLE INTERNET', 'JAYSON/AIRON', 'TRANSFER CUPANG TO SILVERLAND CUPANG', '', '', ''),
(19, 1, 'BAGALSO', 'TRINILISA', 'ZABALA', '0939-931-1950 / 0917-244-9751', 'UNIT 6 DIZON BLDG. LAUREL ST. SAN JOSE', '172.16.6.163', '9845628B38A0', '247213362', '', '', '5', '1', 'GPON 5', '1500', '02/20/2020', '2020-02-20', 'NEW INSTALL CABLE INTERNET', 'JEFF/CRIS', '09/29/2021', '09/29/2021', '', ''),
(20, 1, 'BELEN', 'MA.CLARISSA', 'MACALINAO', '0917-624-8030', '#51 GOMEZ ST. BAGUMBAYAN BALANGA', '172.16.255.224', '9845628B0F50', '247206220', '', '', '8', '1', 'GPON 8', '1500', '02/20/2020', '2020-02-20', 'NEW INSTALL CABLE INTERNET', 'JAYSON/AIRON', '', '', '', ''),
(21, 1, 'DELA CRUZ', 'ALLAN JAY', 'AVANIELLE', '0956-837-7353', '#21 1ST ST.MA. LOURDES CUPANG PROPER', '172.16.255.221', '9845628B1F60', '247212958', '', '', '38', '2', 'GPON 12', '1500', '02/21/2020', '2020-02-21', 'EXISTING CABLE UPGARADE TO FIBER', 'JAYSON/AIRON', '09/28/2021', '09/28/2021', '', ''),
(22, 1, 'BUGAY', 'HILDA', 'BACANI', '0912-133-9411', '#126 B.O TOTO CUPANG PROPER', '172.16.255.220', '9845628B3170', '247213247', '', '', '34', '2', 'GPON 8', '1500', '02/22/2020', '2020-02-22', 'NEW INSTALL / INTERNET ONLY', 'JAYSON/AIRON', '', '', '', ''),
(23, 1, 'CRISOSTOMO', 'EVANGELINE', 'BARTOLOME', '0908-250-5467', '#47 PHASE 3 TALISAY', '172.16.255.218', '9845628B2E10', '247213193', '', '', '7', '1', 'GPON 7', '1500', '02/22/2020', '2020-02-22', 'NEW INSTALL / INTERNET ONLY', 'JEFF/JOEY', '', '', '', ''),
(24, 1, 'MAGBOO', 'ROGELIO', 'INIETO', '0906-269-4335', '#23 GALLARDO ST. CATANING', '172.16.255.217', '9845628B35F0', '247213319', '', '', '10', '1', 'GPON 10', '1500', '02/24/2020', '2020-02-24', 'NEW INSTALL / INTERNET CABLE - NAG PA BOX', 'ROMER/JAYSON', '', '', '', 'INSTALL BOX 01/05/2021'),
(25, 1, 'ILAGAN', 'DANILO', 'SUBIA', '0917-533-5519', '5TH ST. CUPANG PROPER', '172.16.255.216', '9845628B26D0', '247213077', '', '', '38', '2', 'GPON 12', '1500', '02/24/2020', '2020-02-24', 'EXISTING CABLE UPGARADE TO FIBER', 'ROMER/JAYSON', '', '', '', ''),
(26, 1, 'SATURNO', 'HENRY', 'SOLAR', '0908-306-6869', 'CAMP. TOLENTINO CAMPSITE TENEJERO', '172.16.255.215', '9845628B18E0', '247212854', '', '', '26', '3', 'GPON 8', '1400', '02/24/2020', '2020-02-24', 'NEW INSTALL CABLE INTERNET', 'JEFF/JOEY/JOJO', '', '', '', ''),
(27, 1, 'ITALIA', 'AIDA', 'REYES', '0905-267-8282', '#53 NAVAL ST. CUPANG PROPER', '172.16.5.149', '9845628B2170', '247212991', '', '', '33', '2', 'GPON 7', '1400', '02/26/2020', '2020-02-26', 'EXISTING CABLE UPGARADE TO FIBER', 'JAYSON/AIRON', '07/27/2021', '07/28/2021', '', ''),
(28, 1, 'CASTRENCE', 'BENJAMIN', 'M', '0915-885-8510', '#86 M.H DEL PILAR ST. CUPANG NORTH', '172.16.3.199', '9845628b38D0', '247213365', '', '', '31', '2', 'GPON0/5:3', '1500', '02/27/2020', '2020-02-27', 'NEW INSTALL CABLE INTERNET', 'JEFF/AIRON', '11/25/2021', '11/26/2021', '', ''),
(29, 1, 'PALISOC', 'JASMIN', 'CLEARVIEW', '300-0681', 'SILVERLAND CUPANG PROPER', '172.16.5.95', '9845628b29A0', '247213122', 'NAP 3 / SLOT 2', 'NAP 3 / SLOT 2', '36', '2', 'GPON 10', '3250', '02/27/2020', '2020-02-27', 'TRANSFER TO FIBER', 'JEFF/AIRON', '', '', '', ''),
(30, 1, 'ALONZO', 'GEMMA', 'BANZON', '0949-177-3333', 'SAN LORENZO VILLAGE CUPANG PROPER', '172.16.255.210', '9845628B4A90', '247213649', '', '', '35', '2', 'GPON 9', '1500', '02/27/2020', '2020-02-27', 'NEW INSTALL CABLE INTERNET', 'JEFF/AIRON', '', '', '', ''),
(31, 1, 'FUERTES', 'JENNELYN', 'PERULO', '0926-319-7153', 'LOT30 MARINEL SUBD. CENTRAL CUPANG', '172.16.255.209', '9845628B24C0', '247213044', '', '', '39', '2', 'GPON 13', '1500', '02/27/2020', '2020-02-27', 'NEW INSTALL CABLE INTERNET', 'JEFF/AIRON', '', '', '', ''),
(32, 1, 'SIZON', 'ZENAIDA', '', '0999-67501916', 'STO.CRISTO CENTRAL CUPANG', '172.16.255.205', '9845628B30D0', '247213237', '', '', '38', '2', 'GPON 12', '1500', '02/29/2020', '2020-02-29', 'EXISTING CABLE UPGARADE TO FIBER', 'JOEY/JEFF', '', '', '', ''),
(33, 1, 'GUILA', 'JOY KAREN', 'CATALAN', '0909-189-4693', '#85 JAENA ST. CUPANG PROPER', '172.16.255.203', '9845628B53A0', '247213794', 'NAP 1 SLOT 1', 'NAP 1 SLOT 1', '33', '2', 'GPON 7', '1500', '02/29/2020', '2020-02-29', 'EXISTING CABLE UPGRADE TO FIBER / DISCONENCT CABLE - INTERNET ONLY', 'JOJO/AIRON', '09/28/2021', '09/28/2021', '', ''),
(34, 1, 'CASTRO', 'ROSARIO', 'T', '0947-650-6402', 'BARCARSE ST. CUPANG PROPER', '172.16.255.202', '9845628B26E0', '247213078', '', '', '31', '2', 'GPON 5', '1500', '02/29/2020', '2020-02-29', 'TRANSFER TO FIBER', 'JOEY/JEFF', '07/27/2021', '07/28/2021', '', ''),
(35, 1, 'CANTA', 'RICHIE BOY', '', '0921-386-2114', 'BLK 12 LOT 1 VILLA LINA SUBD. TENEJERO', '172.16.255.201', '9845628B20D0', '247212981', '', '', '24', '3', 'GPON 6', '1500', '02/29/2020', '2020-02-29', 'NEW INSTALL / INTERNET ONLY', 'JOJO/AIRON', '', '', '', ''),
(36, 1, 'LIMAYO', 'RUBEN', 'REYES', '0939-847-0722', '#1 GENERAL CAPINPIN ST. SAN JOSE', '172.16.255.200', '9845628B3770', '247213343', '', '', '14', '3', 'GPON 11', '1750', '02/29/2020', '2020-02-29', 'TRANSFER TO FIBER - DISCONNECTED CABLE', 'ROMER/JAYSON', '', '', '', 'DOUBLE THE BANDWIDTH'),
(37, 1, 'UMABTANG', 'TIRSO', 'SERRANO', '0998-253-4324', 'AYALA ST. DONA MARIA TENEJERO', '172.16.178.145', '984562EFCC39', '5733', '', '', '23', '3', 'GPON0/5:24', '1500', '02/29/2020', '2020-02-29', 'EXISTING CABLE UPGARADE TO FIBER - ONU REPLACEMENT 01/29/2022', 'JOEY/JEFF', '01/25/2022', '01/25/2022', '', ''),
(38, 1, 'PAGDANGANAN', 'JOSEPH', 'CAMACHO', '0915-867-3417', '#3 NAVAL ST. CUPANG', '172.16.255.198', '9845628B2B40', '247213148', '', '', '33', '2', 'GPON 7', '1750', '02/29/2020', '2020-02-29', 'TRANSFER TO FIBER', 'JOJO/AIRON', '', '', '', 'DOUBLE THE BANDWIDTH'),
(39, 1, 'MICOR', 'EDNA', 'TABAN', '0915-305-7769', '#1117 EMERALD ST. TAGLESVILLE SAN JOSE', '172.16.167.142', '9845628B53D0', '247213797', '', '', '16', '3', 'GPON 13', '1500', '02/29/2020', '2020-02-29', 'TRANSFER TO FIBER', 'JEFF/JOEY', '07/27/2021', '07/30/2021', '', 'DISCONNECT CABLE - 04/30/2022'),
(40, 1, 'PAULE', 'GREGORI', 'MACAPAGAL', '0917-511-3324', 'WHITE PLAINS ST. DONA MARIA TENEJERO', '172.16.255.195', '9845628B39E0', '247213382', '', '', '22', '3', 'GPON 4', '1500', '02/29/2020', '2020-02-29', 'EXISTING CABLE UPGARADE TO FIBER', 'ROMER/JAYSON', '', '', '', ''),
(41, 1, 'GREGORIO', 'RYAN', 'ESTEBAN', '0917-544-9968', '#213 ROSE ST. SAN JOSE', '172.16.255.194', '9845628B2D30', '247213179', '', '', '14', '3', 'GPON 11', '1500', '03/02/2020', '2020-03-02', 'TRANSFER TO FIBER - DISCONNECT CABLE', 'JEFF/JOJO', '', '', '', ''),
(42, 1, 'VALENCIA', 'GINA', 'EUGENIO', '0930-418-4311', '#1 B.O TAHO CUPANG NORTH (DIKE)', '172.16.255.193', '9845628B5020', '247213738', '', '', '31', '2', 'GPON 5', '1250', '03/02/2020', '2020-03-02', 'TRANSFER TO FIBER', 'JAYSON/AIRON', '', '', '', ''),
(43, 1, 'GUINTO', 'JULIUS', 'ARELLANO', '0930-870-2345', '#168 ALARCON ST. CUPANG NORTH', '172.16.255.192', '9845628B3040', '247213228', '', '', '31', '2', 'GPON 5', '1750', '03/02/2020', '2020-03-02', 'TRANSFER TO FIBER - DISCONNECT CABLE', 'JAYSON/AIRON', '', '', '', 'DOUBLE THE BANDWIDTH'),
(44, 1, 'DELA PENA', 'OLIVIA', 'T', '0918-957-7750', 'B1 L11 RUBY ST. STA MARIA TENEJERO', '172.16.255.191', '9845628B18F0', '247212855', '', '', '26', '3', 'GPON 8', '1500', '03/03/2020', '2020-03-03', 'EXISTING CABLE UPGARADE TO FIBER', 'JEFF/AIRON', '', '', '', ''),
(45, 1, 'DECENA', 'JENNIFER', 'LAGMAN', '0919-511-0522', 'DONA MANUEL BANZON ST. DFS', '172.16.2.38', '9845628B2B90', '247213153', '', '', '6', '1', 'GPON 6', '1000', '03/03/2020', '2020-03-03', 'NEW INSTALL CABLE INTERNET', 'JEFF/AIRON', '', '', '', ''),
(46, 1, 'SABLADA', 'MARY JOYCE', 'NAVAL', '240-4847 /', 'DONA MARIA BEL AIR TENEJERO', '172.16.169.40', '9845628B2980', '247213120', '', '', '22', '3', 'GPON 4', '1400', '03/03/2020', '2020-03-03', 'TRANSFER TO FIBER', 'JOEY/JAYSON/SES', '04/25/2022', '04/25/2022', '', ''),
(47, 1, 'NAVA', 'SHIELA MARIE', 'GUEVARRA', '0930-488-6820', 'SAN LORENZO VILLAGE CUPANG PROPER', '172.16.255.187', '9845628B2440', '247213036', '', '', '35', '2', 'GPON 9', '1500', '03/03/2020', '2020-03-03', 'NEW INSTALL CABLE INTERNET', 'JOEY/JAYSON/SES', '', '', '', ''),
(48, 1, 'SEMBLANTE', 'CHITO', 'MAULAS', '0908-891-6281', 'L20 B15 DASMARINAS ST. DONA MARIA TENEJERO', '172.16.255.186', '9845628B15A0', '247212802', '', '', '22', '3', 'GPON 4', '1500', '03/04/2020', '2020-03-04', 'NEW INSTALL CABLE INTERNET', 'JEFF/AIRON', '', '', '', ''),
(49, 1, 'WATKINS', 'GERALDINE', 'LACHICA', '0950-855-2915', 'ANACLETA ST. VILLA LINA TENEJERO', '172.16.255.185', '9845628B4D90', '247213697', '', '', '24', '3', 'GPON 6', '1500', '03/04/2020', '2020-03-04', 'NEW INSTALL CABLE INTERNET - DISCONNECT CABLE 10/04/2021', 'JAYSON/JOEY/SES', '', '', '', ''),
(50, 1, 'ZABALA', 'CESAR', 'BANZON', '', '#1 SUNFLOWER DFS', '172.16.255.184', '9845628B1F20', '247212954', '', '', '1', '1', 'GPON 1', '2250', '03/04/2020', '2020-03-04', 'TRANSFER TO FIBER', 'JEFF/AIRON', '', '', '', ''),
(51, 1, 'VILLASENOR', 'INIGO', 'PASCUAL', '0920-867-8695', 'AUSTRIA ST. CENTRAL CUPANG', '172.16.255.183', '9845628B37F0', '247213351', '', '', '40', '2', 'GPON 14', '1500', '03/04/2020', '2020-03-04', 'NEW INSTALL CABLE INTERNET', 'JEFF/AIRON', '04/25/2022', '04/25/2022', '', ''),
(52, 1, 'BUCE', 'VICTOR', 'YULA', '0922-894-6451', '#20 SAN VICENTE ST. CUPANG PROPER', '172.16.255.182', '9845628B1F10', '247212953', '', '', '33', '2', 'GPON 7', '1500', '03/05/2020', '2020-03-05', 'NEW INSTALL / INTERNET ONLY', 'JEFF/AIRON', '', '', '', ''),
(53, 1, 'CARANZO', 'LORENZO', 'CABANLIT', '0949-987-9192', 'SILVERLAND CUPANG PROPER', '172.16.255.180', '9845628B4220', '247213514', 'NAP 3 / SLOT 2', 'NAP 3 / SLOT 2', '37', '2', 'GPON 11', '1500', '03/05/2020', '2020-03-05', 'NEW INSTALL CABLE INTERNET', 'JEFF/AIRON', '03/25/2022', '03/28/2022', '', 'DISCONNECT CABLE - 03/30/2022'),
(54, 1, 'BRGY HALL SAN JOSE', 'BRGY HALL SAN JOSE', 'BRGY HALL SAN JOSE', '', 'SAN JOSE BRGY HALL', '172.16.169.29', '9845628B3F80', '247213472', '', '', '14', '3', 'GPON 11', '2750', '03/05/2020', '2020-03-05', 'EXISTING CABLE UPGARADE TO FIBER', 'JAYSON/SES', '02/24/2022', '03/02/2022', '', ''),
(55, 1, 'SALAZAR', 'SANDRA ROSE', 'SANTOS', '0909-652-8369', 'ILAYA BLDG POBLACION BALANGA', '172.16.255.178', '9845628B4FE0', '247213734', '', '', '11', '1', 'GPON 11', '1500', '03/07/2020', '2020-03-07', 'NEW INSTALL CABLE INTERNET', 'JAYSON/ROMER', '11/25/2021', '11/26/2021', '', ''),
(56, 1, 'PEREZ', 'MICHIE', 'BARCELONA', '0977-247-7542', '#265 B.O CAMPO TENEJERO', '172.16.167.22', '9845628B4EE0', '247213718', '', '', '26', '3', 'GPON 8', '1500', '03/07/2020', '2020-03-07', 'NEW INSTALL CABLE INTERNET', 'JAYSON/ROMER', '05/25/2022', '05/25/2022', '', ''),
(57, 1, 'PAJARES', 'EMMANUEL', 'TIAMBENG', '0928-687-1498', '#4 STA.MARIA VILLAGE TENEJERO', '172.16.166.72', '9845628B3CF0', '247213431', '', '', '26', '3', 'GPON0/8:5', '1500', '03/07/2020', '2020-03-07', 'TRANSFER TO FIBER', 'JEFF/CRIS', '07/27/2021', '07/30/2021', '', ''),
(58, 1, 'JIMENEZ', 'MARK KENNON', 'ARTUZ', '0949-665-5237', '#646 CAPITOL DRIVE SAN JOSE', '172.16.255.174', '9845628B3F90', '247213473', '', '', '21', '3', 'GPON 3', '1500', '03/09/2020', '2020-03-09', 'TRANSFER TO FIBER', 'AIRON/JAYSON', '11/26/2021', '11/27/2021', '', ''),
(59, 1, 'ROSETE', 'RUBY ROSE', 'FLORES', '0966-753-9146 / 0998-919-8328', 'LEOLY ST. VILLA LINA TENEJERO', '172.16.255.172', '9845628B4EC0', '247213716', '', '', '25', '3', 'GPON 7', '1000', '03/10/2020', '2020-03-10', 'NEW INSTALL CABLE INTERNET', 'JOJO/AIRON', '', '', '', 'rrfrosete@gmail.com'),
(60, 1, 'TAN', 'EFEGENIO MAURICIO', 'MULETA', '0949-992-3210', 'CAPITOL DRIVE SAN JOSE 2ND FLR 7/11', '172.16.255.75', '9845628B41A0', '247213506', '', '', '21', '3', 'GPON0/3:2', '1500', '03/10/2020', '2020-03-10', 'ADD. NET / INTERNET ONLY', 'JAYSON/AIRON', '02/24/2022', '03/02/2022', '', 'mmtanlawfirm@gmail.com'),
(61, 1, 'MENESES', 'KRISTINE REIGN', 'CALMA', '0995-438-1296 / 0949-833-8451', 'GARNET ST. STA.MARIA TENEJERO', '172.16.2.178', '9845628B4100', '247213496', '', '', '26', '3', 'GPON 8', '1500', '03/12/2020', '2020-03-12', 'NEW INSTALL CABLE INTERNET', 'ROMER/JOEY', '11/25/2021', '11/25/2021', '', 'DISCONNECT CABLE 03/24/2022'),
(62, 1, 'MANGUBAT', 'ERIC', 'HERERA', '0999-906-0194', '#5 REMAVILLE SUBD. IBAYO', '172.16.168.230', '9845628B3D80', '247213440', '', '', '19', '3', 'GPON0/1:1', '1500', '03/12/2020', '2020-03-12', 'NEW INSTALL CABLE INTERNET', 'JEFF/JOEY', '', '', '', ''),
(63, 1, 'NAVASQUEZ', 'CHRISTINE', 'CAARE', '0917-890-0638', '#191A MASIKAP ST. CUPANG WEST', '172.16.167.138', '9845628B4870', '247213615', '', '', '30', '2', 'GPON 4', '1250', '03/12/2020', '2020-03-12', 'NEW INSTALL CABLE INTERNET', 'JAYSON/AIRON', '', '', '', 'ejdros@yahoo.com'),
(64, 1, 'CABRERA', 'MELODY', 'PEREZ', '0945-564-9436', '#23 SAN JUAN ST. SIBACAN', '172.16.255.163', '9845628B3DD0', '247213445', '', '', '3', '1', 'GPON 3', '1250', '03/13/2020', '2020-03-13', 'TRANSFER TO FIBER', 'ROMER/JOEY', '', '', '', 'melody_florez18@yahoo.com'),
(65, 1, 'PEREZ', 'MARIA LOURDES', 'BUGAY', '0956-589-4804', '#610 SITIO UGONG CATANING', '172.16.255.162', '9845628B4E60', '247213710', '', '', '28', '2', 'GPON 2', '1500', '03/13/2020', '2020-03-13', 'NEW INSTALL INTERNET ONLY', 'JOJO/AIRON/JEF', '05/25/2022', '05/25/2022', '', 'carlogabaya@gmail.com'),
(66, 1, 'SAPUYOT', 'CHING', 'CABRERA', '0942-396-1199 / 0917-874-0691', 'HERON ST. THE VILLAS DFS', '172.16.255.161', '9845628B3DC0', '247213444', '', '', '2', '1', 'GPON 2', '1750', '03/13/2020', '2020-03-13', 'TRANSFER TO FIBER', 'ROMER/JOEY', '02/26/2021', '02/26/2021', '', 'OLD NAME: ERICA MANANDIC / DOUBLE THE BANDWIDTH'),
(67, 1, 'INGARAN', 'MARISSA', 'ILETO', '0998-579-1996', 'MALIGAYA ST. CUPANG PROPER', '172.16.5.191', '9845628B3D00', '247213432', '', '', '26', '3', 'GPON 8', '1500', '03/21/2020', '2020-03-21', 'TRANSFER TO FIBER', 'JEFF/CRIS', '', '', '', ''),
(68, 1, 'CARLOS', 'ALEJANDRA', 'TORRES', '0995-825-5160', '#12 BO INTSIK SAN JOSE', '172.16.255.157', '9845628B4900', '247213624', '', '', '17', '3', 'GPON 14', '1500', '04/22/2020', '2020-04-22', 'TRANSFER TO FIBER', 'JEFF', '', '', '', ''),
(69, 1, 'BERMUDO', 'ANTONETTE', 'BALMACEDA', '0947-425-8122', '#1 LA PENA APARTMENT DASMARINAS ST DONA MARIA TENEJERO', '172.16.5.176', '9845628B4120', '247213498', '', '', '23', '3', 'GPON 5', '1500', '03/29/2020', '2020-03-29', 'TRANSFER TO FIBER', 'JEFF', '', '', '', ''),
(70, 1, 'ARANAS', 'EMILY', 'GUZMAN', '0909-704-0856', 'FOLGERS ST.CAPIHAN CUPANG', '172.16.255.155', '9845628B48A0', '247213618', '', '', '32', '2', 'GPON 6', '1500', '05/03/2020', '2020-05-03', 'NEW INSTALL CABLE INTERNET', 'JEFF', '', '', '', ''),
(71, 1, 'DELA FUENTE', 'MABEL', 'TUAZON', '', 'BLK 1 LOT 8 DON ANTONIO ST. TENEJERO', '172.16.168.39', '9845628B42E0', '247213526', '', '', '25', '3', 'GPON 7', '1500', '05/04/2020', '2020-05-04', 'TRANSFER TO FIBER', 'JEFF/IAIRON', '', '', '', ''),
(72, 1, 'CAPILI', 'EDITHA', 'SAMSON', '0920-448-8157', '#193 LILIBETH APART. AVOCADO RD. MONARK TUYO', '172.16.255.151', '9845628B3CE0', '247213430', '', '', '12', '1', 'GPON 16', '1000', '05/05/2020', '2020-05-05', 'EXISTING CABLE UPGARADE TO FIBER', 'JEFF/AIRON', '', '', '', ''),
(73, 1, 'ORIA', 'ISAAC', 'PERENA', '0930-329-0820', '135.A MANAHAN ST. TENEJERO', '172.16.255.150', '9845628B4CD0', '247213685', '', '', '19', '3', 'GPON 1', '1500', '05/06/2020', '2020-05-06', 'NEW INSTALL CABLE INTERNET', 'JEFF/AIRON', '', '', '', ''),
(74, 1, 'TALASTAS', 'JHON MICHAEL', 'MALASMAS', '0977-093-9481', '132 A. MANAHAN ST. TENEJERO', '172.16.255.149', '9845628B4950', '247213629', '', '', '19', '3', 'GPON 1', '1500', '05/06/2020', '2020-05-06', 'NEW INSTALL CABLE INTERNET', 'JEFF/AIRON', '04/25/2022', '04/25/2022', '', ''),
(75, 1, 'BILAYON', 'SPARTACUS', 'ADILLE', '0995-971-4300', 'CIANITA`S APT. MANGO ST. MONAK SUBD. TUYO', '172.16.255.148', '9845628B4130', '247213499', '', '', '41', '1', 'GPON 12', '1000', '05/06/2020', '2020-05-06', 'NEW INSTALL CABLE INTERNET', 'JEFF/AIRON', '05/25/2022', '05/25/2022', '', ''),
(76, 1, 'HABIG', 'ELENA', 'IZON', '0939-139-2157', 'MANGO ST. MONARK SUBD. TUYO', '172.16.255.147', '9845628B4620', '247213578', '', '', '41', '1', 'GPON 12', '1250', '05/06/2020', '2020-05-06', 'NEW INSTALL CABLE INTERNET', 'JEFF/AIRON', '', '', '', 'DOWNGRADE 70MBPS TO 30MBPS - 04/13/2022'),
(77, 1, 'BANZON', 'CORAZON', 'M.', '0917-564-1270', '#11 ALONZO APT. MASIKAP ST. CUPNAG WEST', '172.16.255.146 / 172.16.3.159', '9845628B41D0', '247213509', '', '', '30', '2', 'GPON 4', '1500', '05/08/2020', '2020-05-08', 'EXISTING CABLE UPGARADE TO FIBER', 'JEFF/AIRON', '03/25/2021', '03/25/2021', '', 'TOMASCORAZONB@YAHOO.COM'),
(78, 1, 'DIZON', 'MELODY', '', '', 'TENEJERO', '172.16.255.144', '9845628B4340', '247213532', '', '', '19', '3', 'GPON 1', '1000', '05/08/2020', '2020-05-08', 'NEW INSTALL CABLE INTERNET', 'JEFF/AIRON', '', '', '', ''),
(79, 1, 'STEINHART', 'ANTON JOSEF', 'BARTEL', '0947-544-8877', '#11 4TH ST. MARIA LOURDES CUPANG PROPER', '172.16.255.143', '9845628B4DD0', '247213701', '', '', '38', '2', 'GPON 12', '1250', '05/11/2020', '2020-05-11', 'TRANSFER TO FIBER', 'JEFF/AIRON', '', '', '', ''),
(80, 1, 'PENOLA', 'RUED BALTAZAR', 'ASTIA', '0917-856-3521', '#87 MACOPA COR. KAIMITO ST. MONARK SUBD. TUYO', '172.16.0.123', '9845628B39B0', '247213379', '', '', '12', '1', 'GPON 15', '1500', '05/11/2020', '2020-05-11', 'EXISTING CABLE UPGARADE TO FIBER', 'JEFF/AIRON', '', '', '', ''),
(81, 1, 'ESCUDERO', 'GISELA', 'TANGCO', '0938-334-7467', '#39 NAVAL ST. CUPANG PROPER', '172.16.255.140', '9845628B1DC0', '247212932', '', '', '33', '2', 'GPON 7', '1500', '05/12/2020', '2020-05-12', 'NEW INSTALL CABLE INTERNET', 'JEFF/AIRON', '', '', '', ''),
(82, 1, 'DOMINGO', 'AGNES', 'DIWA', '0921-749-8445', '#188 MANAHAN ST. TENEJERO', '172.16.255.139', '9845628B3C20', '247213418', 'NAP 5', 'NAP 5', '20', '2', 'GPON 2', '1500', '05/12/2020', '2020-05-12', 'NEW INSTALL CABLE INTERNET', 'JEFF/AIRON', '', '', '', ''),
(83, 1, 'CRUZ', 'REMEDIOS', 'ROBERT', '0918-496-0620', 'DIAMOND ST. STA.MARIA VILLAGE TENEJERO', '172.16.255.138', '9845628B2E40', '247213196', '', '', '26', '3', 'GPON 8', '1500', '05/12/2020', '2020-05-12', 'NEW INSTALL CABLE INTERNET', 'JEFF/AIRON', '05/25/2022', '05/27/2022', '', ''),
(84, 1, 'GUTIERREZ', 'ANGELETTE', 'M.', '', '# SITIO TOTO CUPANG PROPER', '172.16.255.136', '9845628B2EE0', '247213206', '', '', '34', '2', 'GPON 8', '1500', '05/13/2020', '2020-05-13', 'NEW INSTALL CABLE INTERNET', 'JEFF/AIRON', '', '', '', ''),
(85, 1, 'CABRERA', 'ARJHEN', '?', '0930-138-0391', '# 71 SITIO TOTO CUPANG PROPER', '172.16.255.133', '9845628B39D0', '247213381', '', '', '34', '2', 'GPON 8', '1500', '05/14/2020', '2020-05-14', 'NEW INSTALL CABLE INTERNET - DISCONNECT CABLE 08/03/2021', 'JEFF/AIRON', '', '', '', 'DISCONNECT CABLE 08/03/2021'),
(86, 1, 'PIZARRO', 'LEONARD', 'SOYANGCO', '0917-533-5677', '231 CAPITOL DRIVE SAN JOSE', '172.16.255.132 / 172.16.5.202', '9845628B1E10', '247212937', '', '', '13', '3', 'GPON 10', '2250', '05/15/2020', '2020-05-15', 'TRANSFER TO FIBER', 'JEFF/AIRON', '', '', '', 'LEONARD880563@GMAIL.COM'),
(87, 1, 'LOPEZ', 'RONNIE', '?', '', '# SITIO TOTO CUPANG PROPER', '172.16.255.131', '9845628B3C80', '247213424', '', '', '34', '2', 'GPON 8', '1500', '05/16/2020', '2020-05-16', 'NEW INSTALL CABLE INTERNET', 'JEFF/AIRON', '', '', '', ''),
(88, 1, 'ALONTO', 'ABUL KHAYR', 'MACATBAR', '237-5738', 'LA KATRINA SUBD. DFS', '172.16.1.85', '9845628B1620', '247212810', '', '', '2', '1', 'GPON 2', '1500', '05/16/2020', '2020-05-16', 'TRANSFER TO FIBER', 'JEFF/AIRON', '03/25/2022', '03/26/2022', '', 'MICHELLE.ALONTO@GMAIL.COM'),
(89, 1, 'OCAMPO', 'RONNIE', '', '0921-596-5921', 'GARNET ST. STA.MARIA TENEJERO(INFRONT OF COURT)', '172.16.255.129', '9845628B1CC0', '247212916', '', '', '26', '3', 'GPON 8', '1500', '05/16/2020', '2020-05-16', 'NEW INSTALL CABLE INTERNET', 'JEFF/AIRON', '', '', '', 'OCAMPOMAILEEN75@GMAIL.COM'),
(90, 1, 'SANTOS', 'EVA', 'ROTA', '0965-520-0625', '#561 ESTAGAMENTO BDLG.2ND FLOOR SAN JOSE', '172.16.255.128', '9845628B2FD0', '247213221', '', '', '14', '3', 'GPON 11', '1500', '05/19/2020', '2020-05-19', 'NEW INSTALL CABLE INTERNET - DISCONNECT CABLE 07/16/2021', 'JEFF/AIRON', '', '', '', 'OLD NAME : RALPH KEVIN BELTRAN'),
(91, 1, 'MINA', 'JESSICA', 'ESCUDERO', '0998-259-2067', 'SILVERLAND SUBD. CUPANG PROPER', '172.16.255.125', '9845628B2940', '247213116', '', '', '37', '2', 'GPON0/11:4', '1750', '05/19/2020', '2020-05-19', 'TRANSFER TO FIBER', 'JAYSON/CES', '01/25/2022', '01/31/2022', '', 'DOUBLE THE BANDWIDTH'),
(92, 1, 'GONZALES', 'MICHELLE', 'BERNABE', '0928-724-7414', 'SILVLAND SUBD. CUPANG PROPER', '172.16.255.124', '9845628B30A0', '247213234', '', '', '37', '2', 'GPON0/11:5', '1500', '05/19/2020', '2020-05-19', 'EXISTING CABLE UPGARADE TO FIBER', 'JAYSON/CES', '', '', '', ''),
(93, 1, 'ABALOS', 'GINA LOU', '', '0909-541-4490', 'ACAPULCO ST., ST. ANNE SUBD. CUPANG PROPER', '172.16.255.123', '9845628B3960', '247213374', '', '', '35', '2', 'GPON 9', '1500', '05/19/2020', '2020-05-19', 'NEW INSTALL CABLE INTERNET', 'JEFF/AIRON', '', '', '', ''),
(94, 1, 'VALENCIA', 'FREDERICK', 'VILLARUEZ', '0956-011-7966', '#922 JOSEPH ST. BATAAN HOMES SUBD.', '172.16.2.205', '9845628B17D0', '247212837', '', '', '15', '3', 'GPON 12', '1500', '05/19/2020', '2020-05-19', 'NEW INSTALL CABLE INTERNET', 'JAYSON/CES', '05/25/2022', '05/25/2022', '', 'OLD NAME DALISAY VALENCIA'),
(95, 1, 'SANTOS', 'JOSEFINA', 'GARCIA', '0916-213-4662', '#178 ADELFA ST. DFS', '172.16.255.121', '9845628B1F80', '247212960', '', '', '5', '1', 'GPON 5', '1500', '05/20/2020', '2020-05-20', 'EXISTING CABLE UPGARADE TO FIBER', 'JEFF/CRIS', '', '', '', ''),
(96, 1, 'SERVERA', 'ARNOLD', 'ITALIA', '0927-529-0806', '#71 MA.LOURDES SUBD. CUPANG PROPER', '172.16.5.178', '9845628B3A80', '247213392', '', '', '36', '2', 'GPON 10', '1750', '05/20/2020', '2020-05-20', 'TRANSFER TO FIBER', 'AIRON/JOEY', '', '', '', 'DOUBLE THE BANDWIDTH'),
(97, 1, 'SAN ANTONIO', 'MARIA LUISA', 'D.', '0966-800-8638', '#41 NAVAL ST. CUPANG NORTH', '172.16.255.119', '9845628B3C70', '247213423', '', '', '31', '2', 'GPON 5', '1500', '05/20/2020', '2020-05-20', 'EXISTING CABLE UPGARADE TO FIBER', 'JEFF/CRIS', '04/26/2021', '04/26/2021', '', ''),
(98, 1, 'PANGILINAN', 'LOUIE', 'FAJARD0', '0909-521-4490', '#1 MALIBIRAN APT. ARCENHILLS ST. DONA MARIA TENEJERO', '172.16.255.117', '9845628B2960', '247213118', '', '', '23', '3', 'GPON 5', '1750', '05/20/2020', '2020-05-20', 'TRANSFER TO FIBER', 'AIRON/JOEY', '04/26/2021', '03/31/2021', '', 'DOUBLE THE BANDWIDTH'),
(99, 1, 'DEL MUNDO', 'MARY GRACE', 'ALFANTA', '0909-521-4490', '#31 SILVERLAND SUBD. CUPANG', '172.16.1.168', '9845628B24D0', '247213045', '', '', '37', '2', 'GPON 11', '1500', '05/21/2020', '2020-05-21', 'NEW INSTALL INTERNET ONLY', 'AIRON/JOEY', '12/28/2021', '01/30/2022', '', ''),
(100, 1, 'MOSENABRE', 'BRISEL', 'LORESTO', '0938-054-3819', '#10 CAMIA ST. CUPANG NORTH', '172.16.255.115', '9845628B2890', '247213105', '', '', '34', '2', 'GPON 8', '1500', '05/21/2020', '2020-05-21', 'TRANSFER TO FIBER', 'JEFF/CRIS', '05/25/2022', '05/31/2022', '', 'OLD NAME VILMA MOSENABRE'),
(101, 1, 'BUGAY', 'RHEA', 'SIOSON', '0929-640-8016', '#140 MANAHAN ST. TENEJERO', '172.16.255.114', '9845628B2860', '247213102', '', '', '20', '3', 'GPON 2', '1500', '05/21/2020', '2020-05-21', 'NEW INSTALL CABLE INTERNET', 'AIRON/JAYSON', '', '', '', ''),
(102, 1, 'CHUA', 'SHERYL', 'NISAY', '0928-275-8270', '#3 UNIT 3 NOF APT., MAXWELL ST. CUPANG PROPER', '172.16.255.113', '9845628B3410', '247213289', '', '', '33', '2', 'GPON 7', '1500', '05/22/2020', '2020-05-22', 'TRANSFER TO FIBER', 'JEFF/OCA', '06/25/2021', '', '', 'OLD NAME: NOILAN CHINGCHUANGCO'),
(103, 1, 'DEL ROSARIO', 'REYNARDO', 'WEE', '0947-891-5194', '#157 CUADERNO ST. DONA FRANCESCA', '172.16.5.253', '9845628B26C0', '247213076', '', '', '1', '1', 'GPON0/1:5', '1500', '05/22/2020', '2020-05-22', 'TRANSFER TO FIBER', 'JAYSON/SES', '', '', '', ''),
(104, 1, 'BUSTAMANTE', 'ARIS', 'B.', '0932-741-8620', 'BLK 1 LOT 11 LA KATRINA SUBD. DFS', '172.16.255.110', '9845628B1AC0', '247212884', '', '', '2', '1', 'GPON 2', '1250', '05/22/2020', '2020-05-22', 'EXISTING CABLE UPGARADE TO FIBER', 'JAYSON/SES', '', '', '', ''),
(105, 1, 'CORREA', 'RIZAH', 'PASTRANA', '0917-856-9772', 'PROVO HOMES MALUYA ST. CENTRAL CUPANG', '172.16.255.109', '9845628B4B20', '247213658', '', '', '40', '2', 'GPON 14', '1500', '05/22/2020', '2020-05-22', 'TRANSFER TO FIBER', 'JEFF/OCA', '01/22/2021', '01/29/2021', '', ''),
(106, 1, 'TOLENTINO', 'JOSE MARIE NOEL', 'SUIZO', '0915-471-5734', 'REMEDIOS CAF� CENTRAL CUPANG', '172.16.255.108 / 172.16.244.175', '9845628B3700', '247213336', '', '', '2', '1', 'GPON 2', '1500', '05/22/2020', '2020-05-22', 'TRANSFER TO FIBER', 'JAYSON/SES', '', '', '', ''),
(107, 1, 'ALONZO', 'MARILEN', 'Z.', '0908-891-6239', 'JAENA ST. CUPANG PROPER', '172.16.255.107', '9845628B3020', '247213226', '', '', '33', '2', 'GPON 7', '1500', '05/22/2020', '2020-05-22', 'NEW INSTALL CABLE INTERNET', 'JEFF/OCA', '', '', '', 'OLD NAME: ROWENA CABRETA'),
(108, 1, 'AMADO', 'JEFF', 'FERNANDEZ', '0915-694-1879', '#182 AMBUCLAO SUBD. IBAYO', '172.16.255.106', '9845628B5200', '247213768', '', '', '6', '1', 'GPON 6', '1250', '05/23/2020', '2020-05-23', 'EXISTING CABLE UPGARADE TO FIBER', 'JAYSON/SES', '', '', '', ''),
(109, 1, 'DAVID', 'JONATHAN', 'SUYAT', '0926-594-8698', '#88 MOLAVE ST. MALABIA', '172.16.255.101', '9845628B4540', '247213564', '', '', '5', '1', 'GPON 5', '1250', '05/23/2020', '2020-05-23', 'NEW INSTALL CABLE INTERNET', 'JEFF/AIRON', '', '', '', ''),
(110, 1, 'BANZON', 'EMMA RUTH', 'BALE', '612-0216', '#91 H.BANZON ST. BAGUMBAYAN BALANGA', '172.16.255.100', '9845628B3D60', '247213428', '', '', '9', '1', 'GPON 9', '1500', '05/23/2020', '2020-05-23', 'TRANSFER TO FIBER', 'JAYSON/SES', '02/26/2021', '02/26/2021', '', ''),
(111, 1, 'SUYAT', 'DOLORES', 'AO', '0927-302-5208', '#88 MOLAVE ST. MALABIA', '172.16.5.46', '9845628B4450', '247213549', '', '', '5', '1', 'GPON 5', '1500', '05/23/2020', '2020-05-23', 'TRANSFER TO FIBER', 'JEFF/AIRON', '09/30/2021', '10/04/2021', '', ''),
(112, 1, 'WEE', 'RONALD ALLAN', 'D', '0917-675-0158', '158 CUARDENO ST. DFS', '172.16.255.97', '9845628B45C0', '247213572', '', '', '1', '1', 'GPON0/1:6', '1500', '05/25/2020', '2020-05-25', 'TRANSFER TO FIBER', 'JEFF/CRIS', '05/25/2022', '05/25/2022', '', ''),
(113, 1, 'RUIEDA', 'MARK ANTHONY', 'PALAYPAY', '0920-498-8928', '34 GOMEZ ST. BAGUMBAYAN BALANAGA', '172.16.255.96', '9845628B4CF0', '247213687', '', '', '8', '1', 'GPON 8', '1000', '05/25/2020', '2020-05-25', 'TRANSFER TO FIBER', 'JEFF/CRIS', '', '', '', ''),
(114, 1, 'FLORES', 'JOYCELYN', 'DE LEON', '0927-655-4061', '#3 MJ APT. MASIKAP ST. CUPANG WEST', '172.16.255.95', '9845628B4550', '247213565', '', '', '30', '2', 'GPON 4', '1500', '05/26/2020', '2020-05-26', 'TRANSFER TO FIBER', 'JAYSON/AES', '', '', '', ''),
(115, 1, 'MARIANO', 'ROLI JAY', 'ANGELES', '0917-520-8595', '#6 MJ APT. MASIKAP ST. CUPANG WEST', '172.16.255.94', '9845628B4FD0', '247213733', '', '', '30', '2', 'GPON 4', '1500', '05/26/2020', '2020-05-26', 'NEW INSTALL / INTERNET ONLY', 'JAYSON/SES', '', '', '', ''),
(116, 1, 'BANZON', 'EVA', '', '', 'POBLACION BALANGA BATAAN', '172.16.255.93', '9845628B33D0', '247213285', '', '', '11', '1', 'GPON 11', '1250', '05/27/2020', '2020-05-27', 'EXISTING CABLE UPGARADE TO FIBER', 'JEFF/SES', '', '', '', ''),
(117, 1, 'SWIN', 'JOCEL MAE', 'TABANOD', '0951-316-3870', '#61 WAKAS JAENA ST. CUPANG PROPER', '172.16.4.253', '9845628B4E30', '247213707', '', '', '34', '2', 'GPON 8', '1500', '05/27/2020', '2020-05-27', 'NEW INSTALL CABLE INTERNET', 'JAYSON/SES', '', '', '', ''),
(118, 1, 'TIGAS', 'REMELY', 'HERNANDEZ', '0999-324-6726', 'B.O CAMPO TENEJERO', '172.16.5.94', '9845628B2BD0', '247213157', '', '', '26', '3', 'GPON 8', '1500', '05/28/2020', '2020-05-28', 'NEW INSTALL CABLE INTERNET', 'JAYSON/MAC', '', '', '', ''),
(119, 1, 'PARAISO', 'GILBERT', 'GUITIRREZ', '0918-295-1899', 'B.O CAMPO TENEJERO', '172.16.255.90 / 172.16.5.37', '9845628B2A00', '247213128', '', '', '26', '3', 'GPON 8', '1500', '05/28/2020', '2020-05-28', 'NEW INSTALL CABLE INTERNET', 'JAYSON/MAC', '', '', '', ''),
(120, 1, 'FERNANDEZ', 'ANELLEN', 'GUZMAN', '0939-390-3810', 'MACOPA ST. MONARK SUBD. TUYO', '172.16.255.89', '9845628B3E30', '247213451', '', '', '41', '1', 'GPON 12', '1500', '05/28/2020', '2020-05-28', 'NEW INSTALL CABLE INTERNET', 'JEFF/CRIS', '05/25/2021', '05/26/2021', '', ''),
(121, 1, 'ALMIRANTE', 'MARIE CARMELA', 'CIERIGO', '0906-461-7853', 'SAMPAGUITA ST. VENZON SUBD. CUPANG NORTH', '172.16.4.245', '9845628B43A0', '247213538', 'NAP 3 / SLOT 1', 'NAP 3 / SLOT 1', '29', '2', 'GPON 8', '1400', '05/28/2020', '2020-05-28', 'NEW INSTALL CABLE INTERNET', 'JAYSON/MAC', '12/28/2021', '12/29/2021', '', ''),
(122, 1, 'LAZO', 'JONALYN', 'E.', '0948-349-8148', 'VILLA LINA SUBD. TENEJERO', '172.16.255.87', '9845628B4530', '247213563', '', '', '25', '3', 'GPON 7', '1500', '05/28/2020', '2020-05-28', 'TRANSFER TO FIBER', 'JEFF/CRIS', '', '', '', ''),
(123, 1, 'GUILA', 'MARICAR', '', '0945-639-0577', 'B.O TOTO CUPANG PROPER', '172.16.255.86', '9845628B49B0', '247213635', '', '', '34', '2', 'GPON 8', '1500', '05/28/2020', '2020-05-28', 'NEW INSTALL CABLE INTERNET / DISCONNECT CABLE 06/30/2021', 'JOEY/AIRON', '', '', '', ''),
(124, 1, 'TAPAN', 'EDUARDO', 'BANZON', '0999-313-8127', 'ZABALA COMPOUND. NEAR MARKET SIDE CUPANG PROPER', '172.16.255.84', '9845628B34F0', '247213303', 'NAP 3 / SLOT 4', 'NAP 3 / SLOT 4', '36', '2', 'GPON 10', '1500', '05/29/2020', '2020-05-29', 'TRANSFER TO FIBER - DISCONNECT CABLE 09/03/2021', 'JAYSON/MAC', '12/28/2021', '12/29/2021', '', ''),
(125, 1, 'ORDONIO', 'MARICEL', 'BETOYA', '0920-535-1462', 'MARIMAR ST. ST.ANNE SUBD. CUPANG PROPER', '172.16.255.83', '9845628B37B0', '247213347', '', '', '35', '2', 'GPON 9', '1500', '05/29/2020', '2020-05-29', 'NEW INSTALL CABLE INTERNET - DISCONNECTED CABLE 06/05/2021', 'CRIS/AIRON', '', '', '', ''),
(126, 1, 'ANDRES', 'CECILlE', 'SORIANO', '0921-928-8837', 'STO.NINO CUPANG PROPER', '172.16.255.82', '9845628B3460', '247213294', '', '', '38', '2', 'GPON 12', '1500', '05/29/2020', '2020-05-29', 'TRANSFER TO FIBER', 'JEFF/ERICK', '', '', '', ''),
(127, 1, 'BASE', 'DEMIE', 'DIZON', '0950-874-7521', '#4 MJ APT. MASIKAP ST. CUPANG WEST', '172.16.6.120', '9845628B3DA0', '247213442', '', '', '30', '2', 'GPON 4', '1500', '05/29/2020', '2020-05-29', 'NEW INSTALL CABLE INTERNET', 'JAYSON/MAC', '07/27/2021', '08/15/2021', '', ''),
(128, 1, 'FONSECA', 'MICHAEL', 'D.', '0928-904-7550 / 0921-390-3790', '510 CARNATION SY. DFS', '172.16.255.80', '9845628B1790', '247212833', '', '', '2', '1', 'GPON 2', '1500', '05/29/2020', '2020-05-29', 'EXISTING CABLE UPGARADE TO FIBER', 'JEFF/ERICK', '', '', '', ''),
(129, 1, 'AUSTRIA', 'CHARITO', 'RONQUILLO', '0921-595-5788', '#2 B.O TOTO CUPANG PROPER', '172.16.173.106', '9845628B4A10', '247213641', '', '', '34', '4', 'GPON 1', '1250', '05/29/2020', '2020-05-29', 'NEW INSTALL CABLE INTERNET', 'AIRON/CRIS', '05/25/2022', '06/06/2022', '', ''),
(130, 1, 'RAPIZ', 'ANICIA', 'LLAMERA', '0945-156-3599', '#402 MASAGANA ST. CENTRAL CUPANG', '172.16.255.78', '9845628B37D0', '247213349', '', '', '39', '2', 'GPON 13', '1500', '05/29/2020', '2020-05-29', 'NEW INSTALL / INTERNET ONLY', 'JAYSON/MAC', '12/28/2021', '01/04/2022', '', ''),
(131, 1, 'TORRES', 'TERESITA', 'NAGUIT', '0919-270-4884', '1015 JEREMIAH ST. BATAAN HOMES SAN JOSE', '172.16.255.77', '9845628B4600', '247213576', '', '', '15', '3', 'GPON 12', '1250', '05/29/2020', '2020-05-29', 'EXISTING CABLE UPGARADE TO FIBER', 'JEFF/ERICK', '', '', '', 'FEBBIEJOCO20@YAHOO.COM'),
(132, 1, 'RAMIREZ', 'GREGORIO JR.', 'GABAYA', '0920-643-6198', '#3 HOUSE TO THE RIGHT SUNSHINE SUBD. PHASE 1  TUYO', '172.16.255.74', '9845628B2000', '247212968', '', '', '45', '1', 'GPON 16', '1500', '05/30/2020', '2020-05-30', 'NEW INSTALL / INTERNET ONLY', 'JEFF/ERICK', '04/27/2021', '04/27/2021', '', ''),
(133, 1, 'IZON', 'DANIEL', 'TUNDANGAN', '0956-006-6119', '#429 SUNFLOWER ST. DFS', '172.16.3.95', '9845628B21B0', '247212995', '', '', '4', '1', 'GPON 4', '1500', '05/30/2020', '2020-05-30', 'NEW INSTALL CABLE INTERNET', 'AIRON/CRIS', '04/25/2022', '05/19/2022', '', ''),
(134, 1, 'COMPANERO', 'AMELITA', 'VILLELA', '0917-598-7243', '#6 HOUSE TO THE RIGHT SUNSHINE SUBD. PHASE 1 TUYO', '172.16.167.147', '9845628B2AA0', '247213138', '', '', '45', '1', 'GPON 16', '1500', '05/30/2020', '2020-05-30', 'NEW INSTALL / INTERNET ONLY', 'JEFF/ERICK', '', '', '', ''),
(135, 1, 'ESTANISLAO', 'MARY ANN', 'B', '0999-958-5974', '139 STO CRISTO CENTRAL CUPANG', '172.16.255.71 / 172.16.1.160', '9845628B2BA0', '247213154', '', '', '38', '2', 'GPON 12', '1500', '05/30/2020', '2020-05-30', 'TRANSFER TO FIBER', 'JAYSON/MAC', '04/27/2021', '04/27/2021', '', ''),
(136, 1, 'TICO', 'JENNIFER', 'TORRES', '0933-852-8375', 'BLK 47 LOT 8 GUMAMELA ST. DFS', '172.16.4.191', '9845628B1F70', '247212959', '', '', '2', '1', 'GPON 2', '1750', '05/30/2020', '2020-05-30', 'TRANSFER TO FIBER - DISCONNECT CABLE', 'AIRON/CRIS', '05/25/2022', '05/25/2022', '', 'DOUBLE THE BANDWIDTH'),
(137, 1, 'LEE', '4', 'CARLOS', '237-4643', '#6 VICINAL ST. TUYO', '172.16.255.67', '9845628B2770', '247213087', '', '', '43', '1', 'GPON 14', '1500', '05/30/2020', '2020-05-30', 'EXISTING CABLE UPGARADE TO FIBER', 'JEFF/ERICK', '', '', '', 'WARRENJ200@YAHOO.COM'),
(138, 1, 'GANO', 'JUAN PAOLO', 'TANANO', '0909-902-3219', '319 GLORIA ST. VILLA LINA SUBD. TENEJERO', '172.16.255.64', '9845628B36A0', '247213330', '', '', '24', '3', 'GPON 6', '1000', '06/01/2020', '2020-06-01', 'NEW INSTALL CABLE INTERNET', 'JEFF/ERICK', '', '', '', 'PAOLOGANO19@GMAIL.COM'),
(139, 1, 'CUBACUB', 'ANNALIZA', 'DYCUITAN', '0912-964-2541', 'BLK 10 LOT26 GLORIA ST. DON ANTONIO ST. VILLA LINA', '172.16.255.61', '9845628B22F0', '247213015', '', '', '24', '3', 'GPON 6', '1500', '06/01/2020', '2020-06-01', 'NEW INSTALL CABLE INTERNET - DISCONNECT CABLE 09/30/2021', 'AIRON/CRIS', '12/28/2021', '12/29/2021', '', ''),
(140, 1, 'SANTOS', 'JEFFREY', 'ANGELES', '0920-553-7680', 'STA.MONICA VILLAGE UPPER TUYO', '172.16.3.170', '9845628B2560', '247213054', 'NAP 2 / SLOT 5', 'NAP 2 / SLOT 5', '15', '1', 'GPON0/15:4', '1500', '06/01/2020', '2020-06-01', 'TRANSFER TO FIBER', 'JAYSON/MAC', '01/25/2022', '02/28/2022', '', 'TRANSFER AREA TENEJERO TO STA. MONICA TUYO 06/29/2021'),
(141, 1, 'MAGARRO', 'CRISOSTOMO JR.', 'DIAZ', '0930-879-4339 / 0908-653-3491', '#7 BEL AIR ST. DONA MARIA TENEJERO', '172.16.255.63', '9845628B34A0', '247213298', '', '', '22', '3', 'GPON 4', '1500', '06/01/2020', '2020-06-01', 'EXISTING CABLE UPGARADE TO FIBER', 'AIRON/CRIS', '', '', '', 'TRANSFER AREA FROM DASMARINAS ST. TO BEL AIR ST,'),
(142, 1, 'REINA', 'JENNIFER', 'BAUTISTA', '0948-433-0191 / 0999-743-0439', '101 MANAHAN ST. TENEJERO', '172.16.168.6', '9845628B23D0', '247213029', '', '', '19', '3', 'GPON 1', '1000', '06/01/2020', '2020-06-01', 'NEW INSTALL CABLE INTERNET', 'JEFF/ERICK', '07/27/2021', '08/02/2021', '', ''),
(143, 1, 'SANTOS', 'BRYAN', 'ANGELES', '0929-427-5847', 'BLK 9 LOT 23 DON ANTONIO ST. VILLA LINA', '172.16.5.24', '9845628B1B80', '247212896', '', '', '24', '2', 'GPON 6', '1500', '06/01/2020', '2020-06-01', 'TRANSFER TO FIBER', 'JAYSON/MAC', '02/24/2022', '02/28/2022', '', ''),
(144, 1, 'DE SILVA', 'RUENA', 'DAQUINAG', '0995-889-2429', '#20 DAHLIA ST. VENZON SUBD. CUPANG NORTH', '172.16.255.58', '9845628B2620', '247213066', '', '', '29', '2', 'GPON 3', '1500', '06/01/2020', '2020-06-01', 'EXISTING CABLE UPGARADE TO FIBER', 'JEFF/ERICK', '', '', '', ''),
(145, 1, 'SUNGA', 'MARK ANTHONY', 'D.', '0917-320-1342', 'CUPANG WEST', '172.16.255.56', '9845628B44D0', '247213557', '', '', '30', '2', 'GPON 4', '1250', '06/01/2020', '2020-06-01', 'EXISTING CABLE UPGARADE TO FIBER', 'AIRON/CRIS', '', '', '', ''),
(146, 1, 'DE MESA', 'EDUARDO', 'CANLAS', '0977-163-0457', '276 APT.B ILANG ILANG ST. DFS', '172.16.255.55', '9845628B1760', '247212830', '', '', '4', '1', 'GPON 4', '1500', '06/02/2020', '2020-06-02', 'NEW INSTALL / INTERNET ONLY', 'JAYSON/ROMER', '', '', '', 'SKTDMC@GMAIL.COM'),
(147, 1, 'BALUYOT', 'DEMPSEY', 'QUINTIN', '0910-855-2339', 'BARCARSE ST. CUPANG PROPER', '172.16.255.54', '9845628B1EB0', '247212947', '', '', '31', '2', 'GPON 5', '1500', '06/02/2020', '2020-06-02', 'NEW INSTALL / INTERNET ONLY', 'JEFF/AIRON', '', '', '', ''),
(148, 1, 'NISAY', 'MELINDA', 'JARO', '', '#23 M.H DEL PILAR CUPANG PROPER', '172.16.255.52', '9845628B1D90', '247212929', 'NAP 8 / SLOT 1', 'NAP 8 / SLOT 1', '31', '2', 'GPON 5', '1500', '06/02/2020', '2020-06-02', 'EXISTING CABLE UPGARADE TO FIBER', 'JEFF/AIRON', '', '', '', ''),
(149, 1, 'MANUEL', 'ROSEMARIE', '', '0907-232-1092', 'M.H DEL PILAR CUPANG PROPER', '172.16.255.50', '9845628B31F0', '247213255', '', '', '36', '2', 'GPON 10', '1250', '06/02/2020', '2020-06-02', 'EXISTING CABLE UPGARADE TO FIBER', 'JEFF/AIRON', '', '', '', ''),
(150, 1, 'DELA PAZ', 'VICTOR', 'MAULEON', '0995-825-3520', 'BLK 2 LOT 21 PHASE 3 TALISAY', '172.16.5.180', '9845628B2410', '247213033', '', '', '7', '1', 'GPON 7', '1500', '06/03/2020', '2020-06-03', 'NEW INSTALL CABLE INTERNET', 'ROMER/JAYSON', '', '', '', ''),
(151, 1, 'LEANO', 'CONSORCIA', 'BANTIGUE', '0915-213-9187', 'CHICO ST. DFS', '172.16.5.60', '9845628B2BC0', '247213156', '', '', '1', '1', 'GPON 1', '1500', '06/03/2020', '2020-06-03', 'TRANSFER TO FIBER', 'JEFF/AIRON', '04/25/2022', '04/25/2022', '', ''),
(152, 1, 'ZULUETA', 'JAN JAMISON', 'DE LEON', '0939-121-0639', '#612 MANGGA ST. DFS', '172.16.6.154', '9845628B2920', '247213114', '', '', '1', '1', 'GPON 1', '1500', '06/03/2020', '2020-06-03', 'TRANSFER TO FIBER', 'ROMER/JAYSON', '01/25/2022', '01/26/2022', '', ''),
(153, 1, 'CRUZ', 'JOSE', 'QUIROZ', '0947-899-6452', '#437 SUNFLOWER ST. DFS', '172.16.255.44', '9845628B1DF0', '247212935', '', '', '4', '1', 'GPON 4', '1500', '06/03/2020', '2020-06-03', 'TRANSFER TO FIBER', 'JEFF/AIRON', '', '', '', ''),
(154, 1, 'GARCIA', 'ANITA', 'DE LEON', '0905-451-7885', 'ST.FRANCIS CUPANG PROPER', '172.16.255.41', '98456271F1C0', '247205747', '', '', '35', '2', 'GPON 9', '1500', '06/03/2020', '2020-06-03', 'TRANSFER TO FIBER', 'JEFF/AIRON', '', '', '', ''),
(155, 1, 'LOBRINO', 'RUEL', 'VILLAFUERTE', '0917-843-9189', '89 P.Q ILAYA ST. IBAYO', '172.16.255.40', '9845628B2C60', '247213166', '', '', '5', '1', 'GPON 5', '1750', '06/03/2020', '2020-06-03', 'EXISTING CABLE UPGARADE TO FIBER', 'ROMER/JAYSON', '', '', '', 'DOUBLE THE BANDWIDTH'),
(156, 1, 'RAMIREZ', 'ROBERTO', 'MENDOZA', '0939-294-1423', '#104 MANAHAN ST. TENEJERO', '172.16.255.39', '984562722630', '247206586', '', '', '19', '3', 'GPON 1', '1000', '06/04/2020', '2020-06-04', 'EXISTING CABLE UPGARADE TO FIBER', 'ROMER/JAYSON', '', '', '', ''),
(157, 1, 'FRIZZLE', 'JAYSON', '', '0956-209-2972', '#26 BANZON ST. TUYO', '172.16.171.42', '0055B1075220', '7520', '', '', '43', '1', 'GPON0/14:32', '1500', '06/04/2020', '2020-06-04', 'NEW INSTALL CABLE INTERNET', 'ROMER/JAYSON', '05/25/2022', '05/25/2022', '', ''),
(158, 1, 'SABELLO', 'SAMMY', 'YANDOC', '0945-537-7152', 'BLK 2 LOT 22 DIAMOND ST. STA. MARIA TENEJERO', '172.16.4.51', '984562720BF0', '247206166', '', '', '26', '3', 'GPON 8', '1500', '06/04/2020', '2020-06-04', 'NEW INSTALL CABLE INTERNET', 'OCA/AIRON', '04/25/2022', '04/28/2022', '', ''),
(159, 1, 'BRAVO', 'FELISA', 'CARANDANG', '0998-545-8165', 'STA.MARIA SUBD. TENEJERO', '172.16.255.33', '984562722640', '247206587', '', '', '26', '3', 'GPON 8', '1500', '06/04/2020', '2020-06-04', 'NEW INSTALL / INTERNET ONLY', 'OCA/AIRON', '', '', '', ''),
(160, 1, 'PANTALEON', 'CARL JAYSON', 'CABARRUEBIAS', '0995-961-9060', '#16 SALAZAR ST. TUYO', '172.16.255.32', '9845627126E0', '247206597', '', '', '43', '1', 'GPON 14', '1500', '06/05/2020', '2020-06-05', 'NEW INSTALL / INTERNET ONLY', 'ROMER/JAYSON', '', '', '', ''),
(161, 1, 'RAMOS', 'MARK KENNEDY', 'BRUNO', '0905-556-7597', 'MABINI ST. BAGUMBAYAN BALANGA', '172.16.255.23', '98456271ECB0', '247205666', '', '', '9', '1', 'GPON 9', '1500', '06/05/2020', '2020-06-05', 'NEW INSTALL / INTERNET ONLY', 'ROMER/ERICK', '04/08/2021', '11/27/2021', '', ''),
(162, 1, 'SIOSON', 'MICAH AYESSAH', 'LAGUNA', '0967-255-9193', 'PALMERA SUBD. TENEJERO', '172.16.172.155', '9845627226C0', '247206595', '', '', '13', '3', 'GPON 10', '1500', '06/05/2020', '2020-06-05', 'EXISTING CABLE UPGARADE TO FIBER', 'AIRON/JOEY', '05/25/2022', '05/27/2022', '', 'OLD NAME : RICARDO SIOSON - DISCONNECT CABLE 06/02/2022'),
(163, 1, 'DE GUZMAN', 'EDILBERTO', 'VITANZOS JR', '0928-966-9354', '#07 SARILI ST. CUPANG PROPER', '172.16.1.211', '9845627221C0', '247206515', '', '', '32', '2', 'GPON 6', '1500', '06/05/2020', '2020-06-05', 'EXISTING CABLE UPGARADE TO FIBER', 'OCA/JAYSON', '', '', '', ''),
(164, 1, 'GUARINO', 'DIONIE', 'VALENCIA', '0948-375-0750', '#34 NAVAL ST. CUPANG PROPER', '172.16.255.28', '9845627122F0', '247206534', '', '', '33', '2', 'GPON 7', '1500', '06/05/2020', '2020-06-05', 'NEW INSTALL / INTERNET ONLY', 'OCA/JAYSON', '11/25/2021', '11/25/2021', '', ''),
(165, 1, 'CABERO', 'LEONILA', 'S.', '0939-110-2669', 'BLK 5 LOT 11 LEOLY ST. VILLA LINA SUBD. TENEJERO', '172.16.169.28', '984562722690', '247206592', '', '', '25', '3', 'GPON 7', '1500', '06/05/2020', '2020-06-05', 'EXISTING CABLE UPGARADE TO FIBER', 'JOEY/AIRON', '04/25/2022', '04/25/2022', '', ''),
(166, 1, 'PAMATIAN', 'REBECA', 'DE GUZMAN', '0928-966-9354', 'BARCARSE ST. CUPANG PROPER', '172.16.255.26', '98456271F0D0', '247205732', '', '', '32', '2', 'GPON 6', '1500', '06/05/2020', '2020-06-05', 'NEW INSTALL CABLE INTERNET', 'OCA/JAYSON', '', '', '', ''),
(167, 1, 'RAMOS', 'MYRNA', 'BURGOS', '0919-569-8966 / 0998-383-0920', '# 117 STO.CRISTO SUBD. CENTRAL CUPANG', '172.16.255.25', '98456271F430', '247205786', '', '', '38', '2', 'GPON 12', '1500', '06/05/2020', '2020-06-05', 'TRANSFER TO FIBER', 'ROMER/ERICK', '', '', '', ''),
(168, 1, 'HINA', 'MA.CARMELITA', '', '0908-885-2691', '#619 MOLAVE ST. SAN JOSE', '172.16.255.24', '984562720B50', '247206156', '', '', '21', '3', 'GPON 3', '1500', '06/05/2020', '2020-06-05', 'NEW INSTALL CABLE INTERNET', 'JOEY/AIRON', '', '', '', ''),
(169, 1, 'MENDOZA', 'LOURDES', 'CRUZ', '0956-532-1864', '#987 JEREMIAH ST. BATAAN HOMES SUBD. SAN JOSE', '172.16.255.22', '9842627222D0', '247206532', '', '', '15', '3', 'GPON 12', '1500', '06/06/2020', '2020-06-06', 'TRANSFER TO FIBER', 'ROMER/ERICK', '01/25/2021', '03/23/2021', '', ''),
(170, 1, 'MANUEL', 'AURA MARIE', 'BITUYA', '0920-535-1462', 'STO.NINO CUPANG PROPER', '172.16.165.241', '984562722190', '247206512', '', '', '38', '4', 'GPON0/12:29', '1500', '06/06/2020', '2020-06-06', 'NEW INSTALL CABLE INTERNET / ONU MODEL 4F-E', 'JOEY/AIRON', '04/26/2021', '04/26/2021', '', ''),
(171, 1, 'ESPINOSA', 'ETHEL', 'PENIERO', '0945-507-8087', 'LOTE BANZON, CATANING', '172.16.175.61', '984562722680', '247206591', '', '', '27', '2', 'GPON 1', '2250', '06/06/2020', '2020-06-06', 'TRANSFER TO FIBER', 'ROMER/ERICK', '01/25/2022', '01/25/2022', '', 'UPGRADE MBPS 30MBPS TO 50MBPS - 09/25/2021'),
(172, 1, 'CASTRO', 'CARLO', 'GUTIERREZ', '0998-591-5211', 'BLK 36 LA KATRINA SUBD. DFS', '172.16.0.155', '9845628B1610', '247212809', '', '', '', '1', 'GPON 2', '1500', '06/06/2020', '2020-06-06', 'NEW INSTALL / INTERNET ONLY', 'ROMER/JAYSON', '05/25/2022', '05/25/2022', '', ''),
(173, 1, 'BISO', 'MA. RICHELLE', 'BON', '0919-445-3155', 'BLK 5 LOT 13 SILVERLAND SUBD.CUPAN PROPER', '172.16.255.16', '9845628B1A80', '247212880', '', '', '37', '2', 'GPON 11', '1500', '06/06/2020', '2020-06-06', 'TRANSFER TO FIBER - DISCONNECT CABLE', 'OCA/JAYSON', '', '', '', ''),
(174, 1, 'GOYAL', 'ANNACEL', 'QUITCHZO', '0946-769-2527', '#34 NAVAL ST. CUPANG PROPER', '172.16.0.255', '9845628B1A40', '247212876', '', '', '33', '2', 'GPON 7', '1500', '06/06/2020', '2020-06-06', 'NEW INSTALL / INTERNET ONLY', 'OCA/JAYSON', '', '', '', ''),
(175, 1, 'PASCO', 'JOSE', 'DIOZN', '0939-953-9080', '#304 ROXAS ST. SAN JOSE', '172.16.255.14', '9845628B25E0', '247213062', '', '', '12', '3', 'GPON 9', '2250', '06/06/2020', '2020-06-06', 'NEW INSTALL / INTERNET ONLY', 'ROMER/ERICK', '', '', '', ''),
(176, 1, 'ESPUELAS', 'FEDERICO', 'SY', '0918-305-5522', 'MAGAT ST. TENEJERO', '172.16.255.13', '984562722040', '247206491', '', '', '20', '3', 'GPON 2', '1500', '06/06/2020', '2020-06-06', 'NEW INSTALL / INTERNET ONLY', 'JOEY/AIRON', '', '', '', ''),
(177, 1, 'PALACIO', 'RONALD', 'ALARCON', '0908-896-1405', '81 DONA ROSA ST., VILLA LINA SUBD., TENEJERO', '172.16.255.12', '9845628B50D0', '247213749', '', '', '25', '3', 'GPON 7', '1500', '06/08/2020', '2020-06-08', 'EXISTING CABLE UPGRADE TO FIBER', 'ROMER/MAC', '', '', '', '');
INSERT INTO `subscriber_tbl` (`uid_`, `stats`, `LName`, `FName`, `MName`, `CNum`, `Address`, `IPAddr`, `MACAddr`, `SERIAL`, `NAP`, `SLOT`, `LCP`, `OLT`, `GPON`, `PLAN`, `DATE`, `Date_Installed`, `TYPE`, `LINEMAN`, `DISCONNECTED`, `RECONNECTED`, `WIRE`, `REMARKS`) VALUES
(178, 1, 'GARCIA', 'JOSE ANTONIO', 'REYES', '0929-973-7515', 'DON EULALIO ST., VILLA LINA SUBD. TENEJERO', '172.16.245.0', '9845628B5260', '247213774', '', '', '25', '3', 'GPON 8', '1500', '06/08/2020', '2020-06-08', 'TRANSFER TO FIBER', 'ROMER/MAC', '', '', '', ''),
(179, 1, 'DELA FUENTE', 'CARLOS', 'CARLOS', '0908-741-1651', '#3 BALBUENA APART., SILVERLAND SUBD., CUPANG PROPER', '172.16.255.10', '9845628B15E0', '247212806', '', '', '37', '2', 'GPON 9', '1500', '06/08/2020', '2020-06-08', 'EXISTING CABLE UPGRADE TO FIBER', 'JAYSON/AIRON', '', '', '', ''),
(180, 1, 'ALONZO', 'NORMA', 'REYES', '0910-896-1469', '#10 NAVAL ST., CUPANG PROPER', '172.16.255.9', '9845628B52C0', '247213780', '', '', '33', '2', 'GPON 7', '1500', '06/08/2020', '2020-06-08', 'NEW INSTALL CABLE INTERNET', 'JAYSON/AIRON', '', '', '', ''),
(181, 1, 'CUEVAS', 'DONNAVEL', 'SANCHEZ', '0938-439-6856', '#32 ST FRANCIS SUBD., CUPANG PROPER', '172.16.255.8', '9845628B2650', '247213069', '', '', '35', '2', 'GPON 9', '1500', '06/08/2020', '2020-06-08', 'EXISTING CABLE UPGRADE TO FIBER', 'ROMER/MAC', '', '', '', ''),
(182, 1, 'MATIBAG', 'MA WILMA', 'PILAR', '0920-523-9102', '#120 MANAHAN ST., TENEJERO', '172.16.255.6', '9845628B2550', '247213053', '', '', '20', '3', 'GPON 2', '1000', '06/08/2020', '2020-06-08', 'NEW INSTALL CABLE INTERNET', 'ROMER/MAC', '', '', '', ''),
(183, 1, 'SENGIA', 'CECILIA', 'NOMA', '0917-567-1196', 'GEN. KAPINPIN ST., SAN JOSE', '172.16.3.125', '9845628B1660', '247212814', '', '', '22', '3', 'GPON 4', '1500', '06/08/2020', '2020-06-08', 'TRANSFER TO FIBER', 'JOEY/AIRON', '', '', '', ''),
(184, 1, 'GUANZON', 'KATHREEN', 'P.', '0917-142-5479', 'BLUE RIDGE ST. DONA MARIA SUBD. TENEJERO', '172.16.255.5', '9845628B1630', '247212811', '', '', '12', '3', 'GPON 9', '1500', '06/08/2020', '2020-06-08', 'NEW INSTALL CABLE INTERNET', 'AIRON/JEFF', '11/26/2021', '11/26/2021', '', ''),
(185, 1, 'BALUYOT', 'ROSARIO', 'SENGIA', '0917-966-0707', '#18 GUICO ST. DONA ANGELINA TENEJERO', '172.16.255.3', '9845628B52B0', '247213779', '', '', '35', '2', 'GPON 9', '1500', '06/09/2020', '2020-06-09', 'TRANSFER TO FIBER', 'ROMER/RONNIE', '', '', '', ''),
(186, 1, 'LOPEZ', 'KIMBERLY', 'TOLENTINO', '0956-817-7406', 'MARIMAR ST. ST.ANNE SUBD. CUPANG PROPER', '172.16.255.0', '9845628B1D30', '247212923', '', '', '22', '3', 'GPON 4', '1500', '06/09/2020', '2020-06-09', 'NEW INSTALL CABLE INTERNET', 'JAYSON//AIRON', '09/28/2021', '09/29/2021', '', ''),
(187, 1, 'RUIZ', 'EDGARDO', 'SANGCAL', '0917-630-9011', '#34 SANKA ST. CAPIHAN SUBD. CUPANG PROPER', '172.16.255.2', '9845628B2E60', '247213198', '', '', '36', '2', 'GPON0/6:4', '1750', '06/09/2020', '2020-06-09', 'TRANSFER TO FIBER', 'JAYSON/AIRON', '03/25/2021', '03/25/2021', '', 'DOUBLE THE BANDWIDTH'),
(188, 1, 'MENDOZA', 'JOHN PAUL', 'MALIBIRAN', '0945-992-5373 / 0995-595-5241', '#114 MANAHAN ST. TENEJERO', '172.16.169.50', '9845628B21A0', '247212994', '', '', '20', '3', 'GPON 2', '1500', '06/09/2020', '2020-06-09', 'EXISTING CABLE UPGRADE TO FIBER - INTERNET ONLY', 'ROMER/RONNIE', '03/25/2022', '03/25/2022', '', ''),
(189, 1, 'TUAZON', 'EVELYN', 'PAGUIO', '0917-592-0809', 'TUAZON DRIVE. PALMERA SUBD. TENEJERO', '172.16.254.255', '9845628B2C00', '247213160', '', '', '13', '3', 'GPON 10', '1500', '06/09/2020', '2020-06-09', 'EXISTING CABLE UPGRADE TO FIBER', 'ROMER/RONNIE', '', '', '', ''),
(190, 1, 'QUITCHO', 'FR. JOSEPH', 'MAMAWAG', '0917-566-0085', 'LA KATRINA SUBD. DFS', '172.16.254.254', '9845628B3E50', '247213453', '', '', '2', '1', 'GPON 2', '1500', '06/09/2020', '2020-06-09', 'NEW INSTALL CABLE INTERNET', 'JAYSON/AIRON', '', '', '', ''),
(191, 1, 'DOMINGO', 'MELANIE', 'SERICO', '0956-044-8003', '#283 BALAGTAS ST. CATANING', '172.16.254.253', '9845628B3D20', '247213434', '', '', '27', '2', 'GPON 1', '1500', '06/08/2020', '2020-06-08', 'TRANSFER TO FIBER', 'ROMER/RONNIE', '04/26/2021', '04/26/2021', '', 'BUCKSCY@GMAIL.COM'),
(192, 1, 'BUENSUCESO', 'MYKO', 'PALMA', '0918-447-3033', 'BLK 1 LOT 23 MARINELL SUBD. CENTRAL CUPANG', '172.16.254.250', '984562C87DE8', '268202450', '', '', '39', '2', 'GPON 13', '1500', '06/10/2020', '2020-06-10', 'NEW INSTALL INTERNET ONLY', 'ROMER/RONNIE', '', '', '', ''),
(193, 1, 'ENRIQUEZ', 'MA.ELENA', 'TRAJANO', '0948-385-0244', '#19 B.O TOTO CUPANG PROPER', '172.16.1.224', '984562C88112', '268202531', '', '', '29', '2', 'GPON0/1:14', '1500', '06/10/2020', '2020-06-10', 'NEW INSTALL INTERNET ONLY', 'JAYSON/AIRON', '', '', '', ''),
(194, 1, 'IGNACIO', 'ROSALIE', 'VILLANUEVA', '0920-656-3632', '#539 CARNATION ST. DFS', '172.16.5.162', '984562C89080', '268202926', '', '', '1', '1', 'GPON 1', '1500', '06/11/2020', '2020-06-11', 'EXISTING CABLE UPGRADE TO FIBER', 'JEFF/AIRON', '12/28/2021', '12/29/2021', '', ''),
(195, 1, 'PENALOSA', 'ROSELYN', 'G.', '0920-286-6221', '#521 CARNATION ST. DFS', '172.16.254.243', '984562C8A16A', '268203859', '', '', '1', '1', 'GPON 1', '1500', '06/11/2020', '2020-06-11', 'TRANSFER TO FIBER', 'JEFF/AIRON', '', '', '', ''),
(196, 1, 'AQUINO', 'GENNALYN', 'NADAL', '0921-365-5177', 'BLK 11 LOT 33 DON EULALIO ST. VILLA LINA SUBD. TENEJERO', '172.16.254.242', '984562C88A86', '268202773', '', '', '24', '3', 'GPON 6', '1500', '06/11/2020', '2020-06-11', 'NEW INSTALL CABLE INTERNET', 'JEFF/AIRON', '', '', '', ''),
(197, 1, 'PEREIRA', 'ZENAIDA', '?', '0928-206-3509', 'A15 PRIM ROSE ST. DFS', '172.16.254.241', '984562C87B90', '268202390', '', '', '4', '1', 'GPON 4', '1250', '06/11/2020', '2020-06-11', 'EXISTING CABLE UPGRADE TO FIBER', 'ROMER/RONNIE', '', '', '', ''),
(198, 1, 'GARCIA', 'ROSANNA', 'VILLANEA', '0932-380-4836', '#55 SILVERLAND SUBD. CUPANG', '172.16.254.240', '984562C8944A', '268202023', '', '', '37', '2', 'GPON 11', '1500', '06/11/2020', '2020-06-11', 'TRANSFER TO FIBER', 'JAYSON/OCA', '', '', '', ''),
(199, 1, 'BELLEZA', 'ZYAN VER', 'GULINAO', '0998-972-6628', 'BLK 13 LOT 5 DON ANTONIO ST. VILLA LINA SUBD. TENEJERO', '172.16.254.233', '984562C87D16', '268202429', '', '', '24', '3', 'GPON 6', '1500', '06/12/2020', '2020-06-12', 'TRANSFER TO FIBER', 'JAYSON/AIRON', '', '', '', ''),
(200, 1, 'MENDOZA', 'SARAH', 'EVANGELISTA', '0917-143-3451', '#239 JOSE ABAD SANTOS ST. SAN JOSE', '172.16.254.232', '984562C88E1E', '268202865', '', '', '13', '3', 'GPON 10', '1500', '06/12/2020', '2020-06-12', 'TRANSFER TO FIBER', 'ROMER/RONNIE', '', '', '', ''),
(201, 1, 'CUSTODIO', 'GILBERT', 'SANTOS', '0998-992-0353', '#307 BANZON ST. CENTRAL CUPANG', '172.16.254.231', '984562C897E2', '268203115', '', '', '40', '2', 'GPON 14', '1500', '06/12/2020', '2020-06-12', 'NEW INSTALL CABLE INTERNET', 'JAYSON/AIRON', '', '', '', ''),
(202, 1, 'CABRAL', 'MICHAEL', 'JUAREZ', '0918-606-4877', '#35 BARCARSE ST. CUPANG PROPER', '172.16.254.228', '984562C88B12', '268202787', '', '', '32', '2', 'GPON 6', '1500', '06/13/2020', '2020-06-13', 'NEW INSTALL INTERNET ONLY', 'JEFF', '', '', '', ''),
(203, 1, 'LEANO', 'LUZVIMINDA', 'DE LEON', '0909-486-0303', 'SAN CARLOS ST. SIBACAN', '172.16.254.227', '984562C89846', '268203125', '', '', '3', '1', 'GPON 3', '1250', '06/13/2020', '2020-06-13', 'NEW INSTALL CABLE INTERNET', 'JAYSON/OCA', '', '', '', ''),
(204, 1, 'ORIEL', 'MANOLETTE', 'LEANO', '0909-486-0303', 'SAN CARLOS ST. SIBACAN', '172.16.254.226', '984562C89AB2', '268203187', '', '', '3', '1', 'GPON 3', '1250', '06/13/2020', '2020-06-13', 'NEW INSTALL CABLE INTERNET', 'ROMER/RONNIE', '', '', '', ''),
(205, 1, 'TEOFILO', 'ROSITA', 'SIMBOL', '0907-873-2685', 'SIBACAN RD. BAGO MAG TULAY', '172.16.254.225', '984562C89F8A', '268203311', '', '', '3', '1', 'GPON 3', '1750', '06/13/2020', '2020-06-13', 'EXISTING CABLE UPGRADE TO FIBER', 'ROMER/RONNIE', '04/26/2021', '04/27/2021', '', 'DOUBLE THE BANDWIDTH'),
(206, 1, 'VITANZOS', 'JHOMAR JOSE', 'NAVARRO', '0939-373-3875', '#45 MAUNLAD ST. CUPANG WEST', '172.16.254.223', '984562C89CBA', '268203239', '', '', '30', '2', 'GPON 4', '1500', '06/13/2020', '2020-06-13', 'TRANSFER TO FIBER', 'ROMER/RONNIE', '02/26/2021', '03/02/2021', '', ''),
(207, 1, 'SAMSON', 'EDWARD ALLEN', 'CAREL', '0906-081-2618', '#73 JAENA ST. CUPANG PROPER', '172.16.173.255', '984562C88B08', '268202786', 'NAP 1 / SLOT 2', 'NAP 1 / SLOT 2', '33', '2', 'GPON 7', '1500', '06/13/2020', '2020-06-13', 'NEW INSTALL CABLE INTERNET / UPGRADE TO 30MBPS DISCONNECT CABLE 08/29/2021', 'JEFF/CRIS', '07/27/2021', '07/30/2021', '', 'MAY 29 - MARCH-APRIL PAID BALANCE - MAY 1125'),
(208, 1, 'GLORIA', 'INBRIGITTIE', 'GONZALES', '0910-371-8148', 'BATUMBAKAL ST. TENEJERO', '172.16.171.149', '984562C87FF0', '268202505', 'NAP 5 / SLOT 1', 'NAP 5 / SLOT 1', '19', '3', 'GPON 1', '1250', '06/13/2020', '2020-06-13', 'NEW INSTALL CABLE INTERNET', 'AIRON/JOEY', '05/25/2022', '05/25/2022', '', ''),
(209, 1, 'BANZON', 'JOHANNA', 'VILLANUEVA', '0949-602-0646', 'SILVERLAND SUBD. CUPANG PROPER', '172.16.254.217', '984562C87EE2', '268202475', '', '', '37', '2', 'GPON 11', '1250', '06/15/2020', '2020-06-15', 'NEW INSTALL CABLE INTERNET', 'ROMER/RONNIE', '', '', '', ''),
(210, 1, 'HEALTH', 'CENTER', 'TENEJERO', '935-0040', 'TENEJERO BRGY.HALL', '172.16.254.208', '984562C84570', '247213567', '', '', '19', '3', 'GPON 1', '2250', '06/15/2020', '2020-06-15', 'TRANSFER TO FIBER / ONU MODEL 4F-E', 'JOEY/AIRON', '', '', '', ''),
(211, 1, 'QUINO', 'LOURDES', 'BARING', '0908-202-2310', '#9 MARIA LOURDES SUBD. CUPANG PROPER', '172.16.4.179', '984562C88C2A', '268202815', '', '', '36', '2', 'GPON0/10:10', '1250', '06/15/2020', '2020-06-15', 'NEW INSTALL CABLE INTERNET', 'ROMER/RONNIE', '04/25/2022', '04/25/2022', '', ''),
(212, 1, 'REYES', 'JOSE ENRIQUE', 'ARELLANO', '0906-251-1813', '#49A BLK 3 LOT16 REYES APT. PHASE 3 TALISAY', '172.16.0.132', '984562C897CE', '268203113', '', '', '7', '1', 'GPON 7', '1500', '06/15/2020', '2020-06-15', 'NEW INSTALL CABLE INTERNET', 'AIRON/JOEY', '', '', '', ''),
(213, 1, 'ILAYA', 'SUZIE', 'TRUFIL', '0918-962-2416', '#32 SILVERLAND SUBD. CUPANG PROPER', '172.16.1.137', '984562C89062', '268202923', '', '', '37', '2', 'GPON 11', '1500', '06/15/2020', '2020-06-15', 'TRANSFER TO FIBER', 'JAYSON/MAC', '05/25/2021', '05/25/2021', '', ''),
(214, 1, 'BAUTISTA', 'ORLANDO', 'RUIZ', '0915-448-0357', 'BLK 16 LOT 14 DON EULALIO ST. VILLA LINA TENEJERO', '172.16.254.207', '984562C882F2', '268202579', '', '', '22', '3', 'GPON 4', '1250', '06/16/2020', '2020-06-16', 'EXISTING CABLE UPGRADE TO FIBER', 'JAYSON/MAC', '12/28/2021', '', '', ''),
(215, 1, 'AULIDA', 'STEPHANIE', 'LEGAZPI', '0910-615-6117', '#57 STO.NINO CUPANG PROPER', '172.16.254.206', '984562C891C0', '268202958', '', '', '38', '2', 'GPON 12', '1500', '06/16/2020', '2020-06-16', 'NEW INSTALL INTERNET ONLY', 'OCA/RONNIE', '', '', '', ''),
(216, 1, 'MUNGCAL', 'JESSICA', 'GUILA', '0921-470-9425', '#30 4TH ST. MARIA LOURDES CUPANG PROPER', '172.16.254.205', '984562C8776C', '268202284', '', '', '35', '2', 'GPON 9', '1500', '06/16/2020', '2020-06-16', 'NEW INSTALL CABLE INTERNET', 'JOEY/AIRON', '', '', '', ''),
(217, 1, 'RANU', 'BALJINDER', 'SINGH', '0999-442-2937', 'ST. FRANCIS SUBD. CUPANG PROPER', '172.16.254.202', '984562C895DA', '268203063', '', '', '35', '2', 'GPON 9', '1500', '06/16/2020', '2020-06-16', 'TRANSFER TO FIBER', 'JOEY/AIRON', '', '', '', ''),
(218, 1, 'ROMERO', 'BABYLYN', 'MAGLINTE', '0930-156-8465', '#70 MANAHAN ST. TENEJERO', '172.16.254.201', '984562C89576', '268202053', '', '', '21', '3', 'GPON 3', '1500', '06/16/2020', '2020-06-16', 'NEW INSTALL CABLE INTERNET - DISCONNECT CABLE 06/30/2021', 'JAYSON/MAC', '', '', '', ''),
(219, 1, 'SANTOS', 'MAINEE', 'ITALLASGO', '0956-163-2595', '#336 GLORIA ST. VILLA LINA SUBD. TENEJERO', '172.16.4.148', '984562C88C20', '268202814', '', '', '24', '3', 'GPON 6', '1500', '06/16/2020', '2020-06-16', 'TRANSFER TO FIBER - DISCONNECT CABLE 10/25/2021', 'OCA/RONNIE', '', '', '', ''),
(220, 1, 'CUSTODIO', 'EDITHA', 'CRUZ', '0909-086-1106', 'FLORES APT. #2 MANAHAN ST.TENEJERO', '172.16.4.159', '984562C897BA', '268203111', '', '', '21', '3', 'GPON 3', '1500', '06/16/2020', '2020-06-16', 'TRANSFER TO FIBER', 'JAYSON/MAC', '06/26/2021', '06/29/2021', '', ''),
(221, 1, 'PASTELLERO', 'KERVIN', 'SANTOS', '0905-999-1025', 'DREAMLAND ST. DONA MARIA SUBD. TENEJERO', '172.16.254.197', '984562C88D4C', '268202844', '', '', '23', '3', 'GPON 5', '1500', '06/17/2020', '2020-06-17', 'TRANSFER TO FIBER', 'ROMER/RONNIE', '11/26/2021', '11/26/2021', '', ''),
(222, 1, 'AMBROCIO', 'MARICEL', 'FLORES', '0928-608-8749', 'STA.CLARA ST. AMBUCLAO IBAYO', '172.16.254.196', '984562C887A2', '268202699', '', '', '6', '1', 'GPON 6', '1500', '06/17/2020', '2020-06-17', 'NEW INSTALL CABLE INTERNET', 'JAYSON/MAC', '', '', '', ''),
(223, 1, 'SILVA', 'ELIZABETH', 'GALLARDO', '0999-991-2883', 'BLK 4 LOT 30 LEOLY ST. VILLA LINA TENEJERO', '172.16.254.195', '984562C8976A', '268203103', '', '', '25', '3', 'GPON 7', '1000', '06/17/2020', '2020-06-17', 'TRANSFER TO FIBER', 'ROMER/RONNIE', '', '', '', ''),
(224, 1, 'CALIMBAS', 'ANALYN', 'VALERIO', '0912-563-4527', '#3 SITIO TOTO CUPANG PORPER', '172.16.254.193', '984562C897D8', '268203114', '', '', '29', '2', 'GPON 3', '1000', '06/17/2020', '2020-06-17', 'NEW INSTALL CABLE INTERNET', 'AIRON/OCA', '02/24/2022', '02/24/2022', '', ''),
(225, 1, 'JIMENEZ', 'LOLITA', 'DE JESUS', '0919-002-2366', '#478 CATLEA ST. DFS', '172.16.0.204', '984562C875A0', '268202238', '', '', '2', '1', 'GPON 2', '1500', '06/17/2020', '2020-06-17', 'NEW INSTALL CABLE INTERNET', 'ROMER/RONNIE', '04/25/2022', '04/25/2022', '', ''),
(226, 1, 'SANTOS', 'ROMEO', 'LOPEZ', '0949-4004955', '#6 3RD ST. MARIA LOURDES CUPANG PROPER', '172.16.254.190', '984562C88E78', '268202874', '', '', '38', '2', 'GPON 12', '1500', '06/17/2020', '2020-06-17', 'NEW INSTALL CABLE INTERNET', 'JAYSON/MAC', '', '', '', ''),
(227, 1, 'PATRICIO', 'ARIANE', '', '0917-658-1415', 'ST. FRANCIS SUBD. CUPANG PROPER', '172.16.4.225', '984562C89652', '268203075', '', '', '35', '2', 'GPON 9', '1500', '06/17/2020', '2020-06-17', 'NEW INSTALL CABLE INTERNET', 'AIRON/OCA', '07/27/2021', '07/31/2021', '', ''),
(228, 1, 'CANTUIANGCO', 'ROAN', 'VASQUEZ', '0942-049-7770', 'LOT 22 BLK 2 ASPIREY ST. THE VILLAS DFS', '172.16.254.187', '984562C887C0', '268202702', '', '', '2', '1', 'GPON 2', '1500', '06/18/2020', '2020-06-18', 'TRANSFER TO FIBER - DISCONNECT CABLE 07/16/2021', 'ROMER/RONNIE', '02/26/2021', '02/27/2021', '', ''),
(229, 1, 'VALERO', 'ANDREA', 'MALIBIRAN', '0909-498-4288 / 0961-429-1704', '#349 J.P RIZAL ST. PTO.RIVAS IBABA', '172.16.1.56', '984562C89256', '268202973', 'NAP 1 / SLOT 8', 'NAP 1 / SLOT 8', '7', '7', 'GPON0/7:21', '1500', '06/18/2020', '2020-06-18', 'NEW INSTALL CABLE INTERNET / DISCONNECT CABLE 10/12/2021', 'OCA/JAYSON', '04/25/2022', '04/25/2022', '', 'TRANSFER AREA MARINEL CENTRAL TO PTO.RIVAS IBABA 06/09/2021'),
(230, 1, 'CRUZ', 'NORA', 'CABARLO', '0939-928-1687', 'BLK 13 LOT 22 ANACLETA ST. VILLA LINA TENEJERO', '172.16.254.184', '984562C88E0A', '268202863', '', '', '24', '3', 'GPON 6', '1500', '06/18/2020', '2020-06-18', 'NEW INSTALL INTERNET ONLY', 'JAYSON/MAC', '', '', '', ''),
(231, 1, 'TALLORIN', 'JEFFREY', 'DOMINISE', '0995-555-3247', '261 MARIA LOURDES ST. CENTRAL CUPANG', '172.16.254.176', '984562C89C42', '268203227', '', '', '40', '2', 'GPON 14', '1000', '06/18/2020', '2020-06-18', 'NEW INSTALL CABLE INTERNET', 'JAYSON/MAC', '07/27/2021', '07/31/2021', '', ''),
(232, 1, 'REMIREZ', 'CHESTER', 'FERNANDEZ', '0999-224-1856', '#107 MH DEL PILAR CUPANG NORTH', '172.16.254.174', '984562C89CEC', '268203244', '', '', '34', '2', 'GPON 8', '1250', '06/19/2020', '2020-06-19', 'NEW INSTALL CABLE INTERNET', 'OCA/RONNIE', '', '', '', ''),
(233, 1, 'DIZON', 'CONTESSA', 'VARGAS', '09275665852 / 09399548318', '#248 CADENA DE AMOUR ST. DFS', '172.16.1.215', '984562C89544', '268203048', 'NAP 2 / SLOT 4', 'NAP 2 / SLOT 4', '4', '1', 'GPON0/4:34', '1250', '06/19/2020', '2020-06-19', 'EXISTING CABLE UPGRADE TO FIBER', 'AIRON/ERICK', '', '', '', 'TRANSFER AREA DFS TO CUPANG - RONNIE/SES 07/01/2021 TRANSFER ARE FROM UNIT 7 2ND FLOOR RECEDENCIA APT. GUMAMELA ST. CUPANG NORTH VENZON TO DFS'),
(234, 1, 'CELESTIAL', 'EDUARDO', 'QUINDOY', '0908-894-3998', '#15 1ST ST. MARIA LOURDES SUBD. CUPANG PROPER', '172.16.4.92', '984562C87C58', '268202410', '', '', '38', '2', 'GPON 12', '1500', '06/19/2020', '2020-06-19', 'EXISTING CABLE UPGRADE TO FIBER - DISCONNECT CABLE 07/27/2021', 'OCA/RONNIE', '07/27/2021', '07/27/2021', '', ''),
(235, 1, 'GARCIA', 'MAYETTE', 'GONZALES', '0917-624-3085', '113 MAPALAD ST. CUPANG WEST', '172.16.254.166', '984562C88C52', '268202819', '', '', '31', '2', 'GPON 4', '1500', '06/19/2020', '2020-06-19', 'NEW INSTALL CABLE INTERNET', 'JAYSON/MAC', '', '', '', ''),
(236, 1, 'CUIZON', 'GLENDALE', 'GALLARDO', '0915-877-3665', '#84 HUGO BANZON ST. BAGUMBAYAN BALANGA', '172.16.254.170', '984562C89EFE', '268203297', '', '', '11', '1', 'GPON 11', '1000', '06/19/2020', '2020-06-19', 'EXISTING CABLE UPGRADE TO FIBER', 'OCA/RONNIE', '', '', '', ''),
(237, 1, 'TANEGA', 'NORBERTO', 'CARLOS', '09985572845 / 09483514791', '704 ATIS ST. DFS', '172.16.254.168', '984562C88FC2', '268202907', '', '', '3', '1', 'GPON 3', '1500', '06/19/2020', '2020-06-19', 'EXISTING CABLE UPGRADE TO FIBER', 'AIRON/ERICK', '', '', '', ''),
(238, 1, 'SIONGCO', 'CELESTE', 'TOCA', '0946-464-7407', '#67 BATUNGBAKAL ST. TENEJERO', '172.16.254.167', '984562C8958A', '268203055', 'NAP 5 / SLOT 2', 'NAP 5 / SLOT 2', '19', '3', 'GPON 1', '1500', '06/19/2020', '2020-06-19', 'NEW INSTALL INTERNET ONLY', 'JAYSON/MAC', '02/26/2021', '02/26/2021', '', ''),
(239, 1, 'DE GUZMAN', 'VILLALUZ', 'ARANAS', '0956-533-6143', '#4 1ST. MARIA LOURDES SUBD. CUPANG PROPER', '172.16.254.165', '984562C88FA4', '268202904', '', '', '38', '2', 'GPON 12', '1500', '06/19/2020', '2020-06-19', 'NEW INSTALL CABLE INTERNET', 'OCA/RONNIE', '', '', '', ''),
(240, 1, 'TRANATE', 'FRENALYN', 'MATIAS', '0921-495-1963', 'MASIKAP ST. CUPANG WEST', '172.16.168.213', '984562C888BA', '268202727', 'NAP 7 / SLOT 4', 'NAP 7 / SLOT 4', '30', '7', 'GPON0/3:27', '1500', '06/20/2020', '2020-06-20', 'NEW INSTALL CABLE INTERNET', 'OCA/AIRON', '04/25/2022', '04/25/2022', '', 'TRANSFER AREA TENEJERO TO CUPANG           05/27/2021'),
(241, 1, 'TULFO', 'ROBELINE', 'BALUYOT', '0917-130-0878', '801 REMEDIOS FARM CENTRAL CUPANG', '172.16.175.28', '984562C8A066', '268203333', '3RD LAYER', '3RD LAYER', '14', '7', 'GPON0/14:8', '1750', '06/20/2020', '2020-06-20', 'NEW INSTALL CABLE INTERNET', 'ROMER/RONNIE', '04/25/2022', '04/25/2022', '', 'DOUBLE THE BANDWIDTH'),
(242, 1, 'PASCUAL', 'ELIZABETH', 'BALUYOT', '0917-502-7586', '801 REMEDIOS FARM CENTRAL CUPANG', '172.16.3.225', '984562C88BBC', '268202804', '', '', '40', '2', 'GPON 14', '1500', '06/20/2020', '2020-06-20', 'NEW INSTALL CABLE INTERNET', 'ROMER/RONNIE', '04/25/2022', '05/02/2022', '', ''),
(243, 1, 'MENDOZA', 'ELEANOR EVE', 'DIN', '0915-194-8253', 'SITIO TOTO CUPANG PORPER', '172.16.5.148', '984562C88928', '268202738', '', '', '29', '2', 'GPON 3', '1500', '06/20/2020', '2020-06-20', 'NEW INSTALL CABLE INTERNET', 'JAYSON/MAC', '', '', '', ''),
(244, 1, 'REYES', 'JOANA MARIE', 'ELMA', '0927-711-2223', '#17 1ST. MARIA LOURDES CUPANG PROPER', '172.16.254.157', '984562C88DCE', '268202857', '', '', '38', '2', 'GPON 12', '1250', '06/20/2020', '2020-06-20', 'TRANSFER TO FIBER', 'AIRON/OCA', '', '', '', ''),
(245, 1, 'VALENTOS', 'LOURDES', 'INIETO', '0999-314-9161', '#91 MALIGAYA ST. CUPANG WEST', '172.16.254.152', '984562C8A46C', '268203436', '', '', '30', '2', 'GPON 4', '1500', '06/22/2020', '2020-06-22', 'NEW INSTALL INTERNET ONLY', 'JAYSON/MAC', '', '', '', ''),
(246, 1, 'ROCO', 'ROBERT', 'EVANCULLA', '0919-902-6467', 'SITIO TOTO CUPANG PORPER', '172.16.1.247', '984562C88874', '268202720', '', '', '29', '2', 'GPON 4', '1500', '06/22/2020', '2020-06-22', 'NEW INSTALL INTERNET ONLY', 'JAYSON/MAC', '03/26/2021', '03/26/2021', '', ''),
(247, 1, 'CUENO', 'SHIRLEY', 'SADDI', '0948-433-0919', '# 525 CARNATION ST. DFS', '172.16.254.148 / 172.16.2.97', '984562C88F22', '268202891', '', '', '20', '3', 'GPON 2', '1000', '06/22/2020', '2020-06-22', 'TRANSFER TO FIBER', 'ROMER/RONNIE', '04/26/2021', '04/26/2021', '', ''),
(248, 1, 'NISAY', 'ALFREDO', 'BURGOS', '0906-372-1609', '#84 MARIA LOURDES SUBD. CUPANG PORPER', '172.16.0.179', '984562C89878', '268203130', '', '', '37', '2', 'GPON0/11:7', '1500', '06/22/2020', '2020-06-22', 'TRANSFER TO FIBER', 'JAYSON/CRIS/MAC', '05/25/2022', '06/01/2022', '', ''),
(249, 1, 'SIOSON', 'EARL MARTIN', 'PABURDA', '0909-748-1044', 'UNIT 1 LAZO APT. MARINEL SUBD. CENTRAL CUPANG', '172.16.254.146', '984562C8A336', '268203405', '', '', '39', '2', 'GPON 13', '1500', '06/22/2020', '2020-06-22', 'NEW INSTALL CABLE INTERNET', 'AIRON/JOEY/OCA', '01/25/2022', '01/25/2022', '', ''),
(250, 1, 'CASTILLO', 'JOCELYN', 'GABRIEL', '0921-327-7593', '#157 SITIO TOTO CUPANG PROPER', '172.16.254.144', '984562C8891E', '268202737', '', '', '29', '2', 'GPON 3', '1750', '06/22/2020', '2020-06-22', 'NEW INSTALL INTERNET ONLY', 'JAYSON/CRIS/MAC', '', '', '', 'DOUBLE THE BANDWIDTH'),
(251, 1, 'ILAYA', 'JOY', 'JIMENEZ', '0930-339-2386', 'J.P ST.NATIONAL RD. TALISAY', '172.16.254.142', '984562C87BC2', '268202395', '', '', '9', '1', 'GPON 9', '1500', '06/22/2020', '2020-06-22', 'EXISTING CABLE UPGRADE TO FIBER', 'OCA/AIRON/JOEY', '02/26/2021', '03/02/2021', '', ''),
(252, 1, 'LOPEZ', 'GODOFREDO', 'REYES', '0956-451-009 / 0918-639-7613', 'EMERALD ST. STA.MARIA VILLAGE TENEJERO', '172.16.254.139', '984562C8A5D4', '268203472', '', '', '26', '3', 'GPON 8', '1500', '06/23/2020', '2020-06-23', 'EXISTING CABLE UPGRADE TO FIBER', 'AIRON/JOEY', '', '', '', ''),
(253, 1, 'VELASCO', 'BRIAN', 'DIWA', '0929-642-7518', '#148 MASINOP ST. CUPANG WEST', '172.16.0.236', '984562C8A426', '268203429', '', '', '30', '2', 'GPON 4', '1500', '06/23/2020', '2020-06-23', 'TRANSFER TO FIBER', 'ROMER/RONNIE', '11/26/2021', '11/26/2021', '', ''),
(254, 1, 'LOPEZ', 'REYNALDO', 'DE GUZMAN', '0910-521-1618', '#121 B.O TOTO CUPANG PROPER', '172.16.254.136', '984562C88888', '268202722', '', '', '29', '2', 'GPON 3', '1500', '06/23/2020', '2020-06-23', 'NEW INSTALL INTERNET ONLY', 'AIRON/JOEY', '', '', '', ''),
(255, 1, 'CAMPOMANES', 'CONSOLACION', 'SAVELLA', '0908-959-3129', 'AUSTRIA SUBD. MANGAHAN ST. CENTRAL CUPANG', '172.16.254.135', '984562C87820', '268202302', '', '', '40', '2', 'GPON 14', '1500', '06/23/2020', '2020-06-23', 'TRANSFER TO FIBER', 'OCA/JAY/MAC', '', '', '', 'REQUEST BY SUBS. DISCO CABLE 02/09/2022'),
(256, 1, 'TAGUINOD', 'MARK JAYSON', 'ANGELES', '0928-953-6864', 'BLK 4 LOT 33 ROSIE ST. VILLA LINA SUBD. TENEJERO', '172.16.254.133', '984562C89E04', '268203272', '', '', '25', '3', 'GPON 7', '1500', '06/23/2020', '2020-06-23', 'TRANSFER TO FIBER', 'AIRON/JOEY', '07/27/2021', '', '', ''),
(257, 1, 'SALAZAR', 'JARED JOEL', 'GUILA', '0915-441-8448', '#10 ROSAS ST. VENZON SUBD. CUPANG NORTH', '172.16.254.130 / 172.16.244.12', '984562C87D66', '268202437', 'NAP 3 / SLOT 3', 'NAP 3 / SLOT 3', '29', '2', 'GPON0/8:6', '1500', '06/23/2020', '2020-06-23', 'NEW INSTALL INTERNET ONLY', 'JOEY/AIRON', '', '', '', 'JJ_SALAZAR05@HOTMAIL.COM'),
(258, 1, 'MANUEL', 'MARIA ELCY', 'SAMSON', '0939-335-1232', '#195 CALERO ST. IBAYO', '172.16.254.129', '984562C898C8', '268203138', '', '', '6', '1', 'GPON 6', '1250', '06/24/2020', '2020-06-24', 'NEW INSTALL CABLE INTERNET - UPGRADE TO 10MBPS 05/03/2021', 'ROMER/RONNIE', '11/25/2021', '11/26/2021', '', ''),
(259, 1, 'MENDOZA', 'MA.LOURDES', 'MINTA', '0910-801-3324', '#114 BATUNGBAKAL ST. TENEJERO', '172.16.2.48', '984562C89A6C', '268203180', 'NAP 5 / SLOT 3', 'NAP 5 / SLOT 3', '19', '3', 'GPON 1', '1500', '06/24/2020', '2020-06-24', 'TRANSFER TO FIBER', 'JAYSON/MAC', '07/27/2021', '07/28/2021', '', ''),
(260, 1, 'ENRIQUEZ', 'EVELEA', 'CRUZ', '0921-596-6878', '#58 NAVAL ST. CUPANG PROPER', '172.16.1.226', '984562C88EC8', '268202882', '', '', '33', '2', 'GPON 7', '1500', '06/24/2020', '2020-06-24', 'NEW INSTALL INTERNET ONLY', 'JEFF/CRIS', '01/25/2022', '01/26/2022', '', ''),
(261, 1, 'DE JESUS', 'ARMAN', 'PEREZ', '0906-554-7809', '#750 PUROK 7 MIRAY ST. CATANING', '172.16.1.13', '984562C87D52', '268202435', '', '', '28', '2', 'GPON 2', '1500', '06/24/2020', '2020-06-24', 'NEW INSTALL INTERNET ONLY', 'JOEY/AIRON', '', '', '', ''),
(262, 1, 'SANTOS', 'MA.CONCEPCION', 'BITANGA', '0908-157-5233', '#36 J.P RIZAL ST. TALISAY', '172.16.1.209', '984562C88180', '268202542', '', '', '9', '1', 'GPON 9', '1500', '06/24/2020', '2020-06-24', 'NEW INSTALL CABLE INTERNET', 'ROMER/RONNIE', '', '', '', ''),
(263, 1, 'VALDEZ', 'NATHANIEL', 'NERO', '0948-252-0987', 'DOOR 2 ALEXANDRIA APT. BATUNGBAKAL ST. TENEJERO', '172.16.254.124', '984562C88B80', '268202798', '', '', '19', '3', 'GPON 1', '1500', '06/24/2020', '2020-06-24', 'NEW INSTALL INTERNET ONLY', 'JAYSON/MAC', '', '', '', ''),
(264, 1, 'BACANI', 'VIOLETA', 'POBLETE', '09302778230/09190609338', '#126 SITIO TOTO CUPANG PROPER', '172.16.254.118', '984562C8A35E', '268203409', '', '', '29', '2', 'GPON 3', '1500', '06/24/2020', '2020-06-24', 'NEW INSTALL INTERNET ONLY', 'OCA/JAYSON/MAC', '', '', '', ''),
(265, 1, 'TUCRANG', 'DANIEL', 'DIZON', '0946-184-6443', '#7 NAVAL ST. CUAPNG PROPER', '172.16.', '984562C87D34', '268202432', '', '', '33', '2', 'GPON 7', '1500', '06/24/2020', '2020-06-24', 'NEW INSTALL INTERNET ONLY', 'AIRON/JOEY', '', '', '', ''),
(266, 1, 'MANGAWANG', 'JONADAB', 'BOLI', '0977-094-2198', 'BATUNGBAKAL ST. TENEJERO', '172.16.254.107', '984562C8A7B4', '268203520', 'NAP 5 / SLOT 5 2ND LAYER', 'NAP 5 / SLOT 5 2ND LAYER', '19', '3', 'GPON 1', '1500', '06/25/2020', '2020-06-25', 'NEW INSTALL INTERNET ONLY', 'JEFF/ERICK', '11/26/2021', '12/03/2021', '', ''),
(267, 1, 'BELTRAN', 'MARICOR', 'ZABALA', '0917-812-2394', '#729 MALUYA ST. CENTRAL CUPANG', '172.16.254.115', '984562C83BE0', '247213414', '', '', '40', '2', 'GPON 14', '1500', '06/25/2020', '2020-06-25', 'WARRANTY REPLACEMENT', 'AIRON/JOEY', '', '', '', ''),
(268, 1, 'ALBARAN', 'MYRA', 'AGAYAN', '0915-550-9584', '#13 RAMOS ST. CUPANG PROPER', '172.16.1.189', '984562C8971A', '268203095', 'NAP 7 / SLOT 2', 'NAP 7 / SLOT 2', '31', '2', 'GPON 5', '1500', '06/25/2020', '2020-06-25', 'NEW INSTALL CABLE INTERNET', 'ROMER/RONNIE', '', '', '', ''),
(269, 1, 'DE JESUS', 'NERISA', 'DELA ROSA', '0949-028-9610', '#710 CENTRAL CUPANG', '172.16.254.110', '984562C8A930', '268203558', '', '', '40', '2', 'GPON 14', '1500', '06/25/2020', '2020-06-25', 'NEW INSTALL CABLE INTERNET', 'ROMER/RONNIE/OCA', '', '', '', ''),
(270, 1, 'HYUNCHUL', 'KIM', 'A', '0927-116-2975', '#2 JUDGE SILVA APT. STA. MARIA VILLAGE TENEJERO', '172.16.254.109', '984562C8A71E', '268203505', '', '', '26', '3', 'GPON 8', '1500', '06/25/2020', '2020-06-25', 'TRANSFER TO FIBER', 'JOEY/AIRON', '', '', '', ''),
(271, 1, 'MAPENDAN', 'LUCILA', 'ALAVA', '0919-434-9872', 'TESLA APT.#1 CUPANG DIKE', '172.16.0.101', '984562C8A7DC', '268203524', '', '', '31', '2', 'GPON 5', '1500', '06/25/2020', '2020-06-25', 'EXISTING CABLE UPGRADE TO FIBER', 'ROMER/RONNIE/OCA', '04/26/2021', '', '', 'DISCONNECT CABLE 03/24/2022'),
(272, 1, 'REYES', 'AYAHANA', 'SOYANGCO', '0918-664-2755', 'ZABALA COMPOUND. NEAR MARKET SIDE CUPANG PROPER', '172.16.1.51', '984562C8A75A', '268203511', 'NAP 3 / SLOT 5', 'NAP 3 / SLOT 5', '36', '2', 'GPON 10', '1500', '06/25/2020', '2020-06-25', 'NEW INSTALL INTERNET ONLY', 'JAYSON/CRIS/MAC', '05/25/2022', '05/25/2022', '', ''),
(273, 1, 'OMEGA', 'ALPHA', 'PEREZ', '0922-758-1141', '64 BATUNGBAKAL ST. TENEJERO', '172.16.254.102', '984562C8A6E2', '268203499', '', '', '19', '3', 'GPON 1', '1400', '06/26/2020', '2020-06-26', 'EXISTING CABLE UPGRADE TO FIBER', 'AIRON/CRIS', '05/25/2022', '05/31/2022', '', ''),
(274, 1, 'NICDAO', 'LORENZO', 'BOLOSO', '0915-492-2717', '#75 J.P ST. TALISAY', '172.16.254.99', '984562C8AB60', '268203614', '', '', '7', '1', 'GPON 7', '1500', '06/26/2020', '2020-06-26', 'NEW INSTALL CABLE INTERNET', 'ROMER/RONNIE', '04/25/2022', '04/25/2022', '', ''),
(275, 1, 'SERRANO', 'ESTRELLITA', 'VISDA', '0916-784-3982', 'APOSTORAL APT. #3 CENTRAL CUPANG', '172.16.254.97', '984562C8A6CE', '268203497', '', '', '40', '2', 'GPON 14', '1250', '06/26/2020', '2020-06-26', 'EXISTING CABLE UPGRADE TO FIBER', 'OCA/JAYSON/MAC', '01/25/2022', '01/27/2022', '', 'OLD NAME RAUL SERRANO'),
(276, 1, 'BANTUGAN', 'ARIEL', 'FABUNAN', '0939-906-3079', '43 FR SARILI ST. CUPANG PROPER', '172.16.254.96', '984562C88432', '268202611', '', '', '32', '2', 'GPON 6', '1500', '06/26/2020', '2020-06-26', 'EXISTING CABLE UPGRADE TO FIBER', 'ROMER/RONNIE', '11/25/2021', '11/27/2020', '', ''),
(277, 1, 'INGARAN', 'DIONNIE', 'MANINERO', '0949-763-3705', '#67 JAENA ST. CUPANG PROPER', '172.16.1.61', '984562C87FE6', '268202501', '', '', '33', '2', 'GPON0/7:20', '1500', '06/26/2020', '2020-06-26', 'NEW INSTALL INTERNET ONLY', 'ROMER/RONNIE', '01/25/2022', '01/28/2022', '', ''),
(278, 1, 'MANGAWANG', 'JON JON', 'RICAFORT', '0920-343-0552', '#143 BATUNGBAKAL ST. TENEJERO', '172.16.254.93', '984562C8A26E', '268203385', '', '', '19', '3', 'GPON 1', '1250', '06/26/2020', '2020-06-26', 'TRANSFER TO FIBER', 'AIRON/CRIS/ROAN', '', '', '', ''),
(279, 1, 'SEBASTIAN', 'JORGELINE', 'REYES', '0949-652-7939', 'BLK 2 LOT 4 MAIN ST. TIERRA FELIZA TUYO', '172.16.254.90', '984562C88748', '268202690', '', '', '15', '2', 'GPON 15', '1250', '06/27/2020', '2020-06-27', 'NEW INSTALL CABLE INTERNET', 'JEFF/AIRON', '', '', '', ''),
(280, 1, 'MANALAYSAY', 'ANNALYN', 'LAWAN', '0999-524-5068', '#37 DEL CARMEN ST. SIBACAN', '172.16.4.139', '984562C8A746', '268203509', '', '', '3', '1', 'GPON 3', '1500', '06/27/2020', '2020-06-27', 'NEW INSTALL CABLE INTERNET', 'ROMER/RONNIE', '', '', '', ''),
(281, 1, 'VICHUACO', 'AVELINO JR.', 'CARINO', '0919-839-4438', '#134 CAMACHO ST. POBLACION BALANGA(TABI NG J & F)', '172.16.0.141', '984562C8A714', '268203504', '', '', '8', '1', 'GPON0/8:5', '1500', '06/27/2020', '2020-06-27', 'TRANSFER TO FIBER', 'ROMER/RONNIE/AIRON', '05/25/2022', '06/01/2022', '', 'DISCONNECT CABLE 06/02/2022'),
(282, 1, 'DELA CRUZ', 'MARICEL', 'CABICO', '0995-185-0628', '#556 MONTILLA ST. TAPAT NG BRGY HALL CENTRAL CUPANG', '172.16.254.82', '984562C8A430', '268203430', '', '', '39', '2', 'GPON 13', '1500', '06/27/2020', '2020-06-27', 'NEW INSTALL CABLE INTERNET', 'JAYSON/MAC', '', '', '', ''),
(283, 1, 'CRUZ', 'NINA', 'TANAYO', '0956-599-6162/0950-938-9497', 'STO.CRISTO CENTRAL CUPANG', '172.16.254.80', '984562C849C0', '268203636', '', '', '38', '2', 'GPON 12', '1500', '06/29/2020', '2020-06-29', 'NEW INSTALL CABLE INTERNET', 'ROMER/RONNIE', '', '', '', ''),
(284, 1, 'GLORIA', 'NATIVIDAD', 'TUAZON', '0951-346-3639', '#86 MACOPA RD. MONARK SUBD. TUYO', '172.16.254.79', '984562C83200', '268203256', '', '', '41', '1', 'GPON 12', '1500', '06/29/2020', '2020-06-29', 'NEW INSTALL CABLE INTERNET', 'JAYSON/MAC', '', '', '', ''),
(285, 1, 'BERNALDO', 'JOYCELYN', 'GLORIA', '0928-632-0191', '#87 MACOPA RD. MONARK SUBD. TUYO', '172.16.254.78', '984562C84E20', '247213706', '', '', '41', '1', 'GPON 12', '1500', '06/29/2020', '2020-06-29', 'NEW INSTALL INTERNET ONLY', 'JAYSON/MAC', '', '', '', ''),
(286, 1, 'CARLOS', 'CHRISLYN', 'PANGALINAN', '0917-638-1274 / 0923-942-6395', '#523 MARCOS ST. CENTRAL CUPANG', '172.16.254.75', '984562C84FA0', '268203730', '', '', '39', '2', 'GPON 13', '1500', '06/29/2020', '2020-06-29', 'NEW INSTALL CABLE INTERNET', 'ROMER/RONNIE', '', '', '', ''),
(287, 1, 'MORANDARTE', 'ROSALIE', 'MARANTAL', '0977-279-0487/0908-923-4860', 'BLK 2 LOT 8 MASSACHUSETTS ST. TIERRA FELIZA TUYO', '172.16.254.74', '984562C83EF0', '268203463', '', '', '15', '2', 'GPON 15', '1500', '06/29/2020', '2020-06-29', 'NEW INSTALL INTERNET ONLY', 'OCA/AIRON', '', '', '', ''),
(288, 1, 'SALAZAR', 'MANUEL', 'AUSTRIA', '0917-919-5634', '#3 BASILIO ST. MONARK SUBD. TUYO', '172.16.254.72', '984562C84190', '268203505', '', '', '43', '1', 'GPON 14', '2500', '06/29/2020', '2020-06-29', 'EXISTING CABLE UPGRADE TO FIBER', 'JAYSON/MAC', '', '', '', 'UPGRADE 35MBPS TO 60MBPS + DOUBLE THE BANDWIDTH 12/03/2021'),
(289, 1, 'VALERIO', 'VIEJAY', 'TAMAYO', '0928-521-9576', 'BLK 3 LOT 2 EARTHFIELD FOURLANES HOMES TUYO', '172.16.169.59', '9845628B2520', '247213050', '', '', '44', '1', 'GPON 15', '1500', '06/29/2020', '2020-06-29', 'NEW INSTALL CABLE INTERNET', 'OCA/AIRON', '03/25/2021', '03/26/2021', '', ''),
(290, 1, 'CABANA', 'ROLANDO', 'GARCIA', '0909-825-4039', '#63 MANAHAN ST. TENEJERO', '172.16.254.70 / 172.16.5.166', '9845628B3630', '247213323', '', '', '21', '3', 'GPON 3', '1500', '06/29/2020', '2020-06-29', 'NEW INSTALL CABLE INTERNET', 'ROMER/RONNIE', '', '', '', ''),
(291, 1, 'HIZON', 'LUIS', 'RODRIGUEZ', '0920-922-6351/0995-870-7723', 'DAMA DE NOCHE ST. DFS', '172.16.254.69', '9845628B2C10', '247213161', '', '', '2', '1', 'GPON 2', '1500', '06/29/2020', '2020-06-29', 'TRANSFER TO FIBER - DISCONNECT CABLE', 'JAYSON/MAC', '02/24/2022', '02/24/2022', '', ''),
(292, 1, 'LUMIBAO', 'BENJAMIN JOSEPH', 'BALUYOT', '0950-931-8871', 'LUMIBAO APT. ST, FRANCIS UPPER TUYO', '172.16.254.65', '984562C8CC30', '268204454', 'NAP TUBIGAN / SLOT 4', 'NAP TUBIGAN / SLOT 4', '', '1', 'GPON0/15:26', '1500', '06/30/2020', '2020-06-30', 'TRANSFER TO FIBER - DISCONNECT CABLE', 'JAYSON/JOEY/SES', '04/27/2021', '04/29/2021', '', 'TRANSFER AREA TALISAY TO TUYO - 02/26/2022'),
(293, 1, 'ALARCON', 'BRENDA', 'MARASIGAN', '0920-531-6039', 'P.3 BLK LOT 23 DON EULALIO ST. VILLA LINA TENEJERO', '172.16.254.66', '984562C90DF8', '26820', '', '', '24', '3', 'GPON 6', '1250', '06/30/2020', '2020-06-30', 'NEW INSTALL CABLE INTERNET', 'ROMER/RONIE', '06/26/2021', '03/31/2022', '', ''),
(294, 1, 'MONTALES', 'RONNELL', 'MAGNROBANG', '0907-984-0727', '#44 M.H DEL PILAR ST. CUPANG PROPER', '172.16.254.57', '984562C8C1EA', '268204191', '', '', '36', '2', 'GPON 10', '1500', '06/30/2020', '2020-06-30', 'TRANSFER TO FIBER', 'ROMER/AIRON/RONNIE', '05/25/2022', '05/25/2022', '', ''),
(295, 1, 'SANTOS', 'JEFFREY', 'BALOR', '0910-522-6167', 'BLK4 LOT18 LEOLY ST. VILLA LINA SUBD. TENEJERO', '172.16.254.63', '984562C8DB12', '268204835', '', '', '25', '3', 'GPON0/7:13', '1500', '06/30/2020', '2020-06-30', 'NEW INSTALL CABLE INTERNET', 'ROMER/RONNIE', '', '', '', ''),
(296, 1, 'MAMALATEO', 'JOHNLOYD', 'DESTURA', '0928-122-0626', 'UNIT 2 JURES APT. #5 STO.NINO CUPANG', '172.16.254.61', '984562C94C8C', '268207740', '', '', '38', '2', 'GPON 12', '1500', '06/30/2020', '2020-06-30', 'NEW INSTALL INTERNET ONLY', 'OCA/AIRON/ROAN', '', '', '', ''),
(297, 1, 'RAMIREZ', 'MEGUELA', 'REYES', '0908-896-6073', 'BLK 1 LOT 39 DON EULALIO ST. VILLA LINA TEEJERO', '172.16.254.60', '984562C94BB0', '268207718', '', '', '24', '3', 'GPON 6', '1750', '06/30/2020', '2020-06-30', 'TRANSFER TO FIBER', 'ROMER/RONNIE', '', '', '', 'DOUBLE THE BANDWIDTH'),
(298, 1, 'SEVILLA', 'MELANIE', 'PIZARRO', '0936-965-9755', 'ADELFA ST. VENZON SUBD. CUPANG NORTH', '172.16.254.58', '984562C8CBD6', '268204445', '', '', '34', '2', 'GPON 8', '1500', '06/30/2020', '2020-06-30', 'TRANSFER TO FIBER', 'ROMER/AIRON/RONNIE', '', '', '', ''),
(299, 1, 'PINEDA', 'CHRISTER ROSE', 'CASTILLO', '0923-693-7882', '# 11 BLEND 45 ST. KAPIAHAN CUPANG PROPER', '172.16.254.56', '984562C8F26E', '268205433', '', '', '33', '2', 'GPON 7', '1500', '06/30/2020', '2020-06-30', 'NEW INSTALL INTERNET ONLY', 'JEFF/ERICK', '', '', '', ''),
(300, 1, 'BARTOLOME', 'MICHELLE', 'PECO', '0948-933-2121', '#91 MOLAVE ST. DFS', '172.16.254.55', '984562C911B8', '268206234', '', '', '5', '1', 'GPON 5', '1500', '06/30/2020', '2020-06-30', 'NEW INSTALL INTERNET ONLY', 'OCA/JAYSON', '', '', '', ''),
(301, 1, 'JOCSON', 'MYLENE', 'DE MESA', '0919-317-1941', '#161 B.O TOTO CUPANG PROPER', '172.16.1.120', '984562C8C03C', '268204148', '', '', '29', '2', 'GPON0/3:30', '1500', '06/30/2020', '2020-06-30', 'NEW INSTALL INTERNET ONLY', 'JEFF/JOEY/JEFF', '01/27/2021', '01/27/2021', '', ''),
(302, 1, 'CAPILI', 'RENATO', 'SAMBAT', '0919-874-4893', '#15 VICINAL ST. TUYO', '172.16.254.50', '984562C8EE22', '268205323', '', '', '43', '1', 'GPON 14', '1500', '06/30/2020', '2020-06-30', 'TRANSFER TO FIBER', 'ROMER/RONNIE/AIRON', '03/25/2022', '03/26/2022', '', ''),
(303, 1, 'CAP-ATAN', 'DANILO', 'BONUCAN', '0927-774-0878', '02 JMC APT MOLAVE STREET DFS', '172.16.1.184', '984562C9450C', '268207540', '', '', '6', '1', 'GPON0/6:8', '1500', '07/01/2020', '2020-07-01', 'NEW INSTALL INTERNET ONLY', 'OCA/MAC/JAYSON', '04/25/2022', '05/16/2022', '', ''),
(304, 1, 'MESIA', 'MARIA LAURA', 'VALMONTE', '0999-697-4833', '#3 TANEGA APT. BANZON ST. CENTRAL CUPANG', '172.16.254.46', '984562C93C88', '268207330', '', '', '40', '2', 'GPON 14', '2500', '07/01/2020', '2020-07-01', 'NEW INSTALL CABLE INTERNET', 'ROMER/RONNIE/ERICK', '', '', '', 'DOUBLE THE BANDWIDTH'),
(305, 1, 'CUEVAS', 'CLARRICE CONCESA', 'AGUIRRE', '0919-067-2364', 'J.P RIZAL ST. TALISAY DIZON APT. #2', '172.16.181.52', '984562C93918', '268207242', '', '', '9', '1', 'GPON0/9:13', '1500', '07/01/2020', '2020-07-01', 'NEW INSTALL CABLE INTERNET', 'ROMER/ERIC/RONNIE', '', '', '', 'CLARISSECONCESACUEVAS@GMAIL.COM'),
(306, 1, 'TOLENTINO', 'ROWENA', 'VICENTE', '0939-366-3303', '#34 M.H. DEL PILAR CUPANG', '172.16.2.190', '984562C93BA2', '268207307', '', '', '36', '2', 'GPON 10', '1500', '07/01/2020', '2020-07-01', 'NEW INSTALL CABLE INTERNET - DISCONNECTED CABLE 04/27/2021', 'ROMER/ERIC/RONNIE', '12/28/2021', '12/29/2021', '', ''),
(307, 1, 'MARIANO', 'JESUS', 'CANDIDO', '0926-462-5708', '253 ILANG ILANG ST. DFS', '172.16.254.39', '984562C91046', '268206197', '', '', '4', '1', 'GPON 4', '1500', '07/02/2020', '2020-07-02', 'TRANSFER TO FIBER', 'ROMER/RONNIE', '03/25/2021', '03/29/2021', '', ''),
(308, 1, 'ALONZO', 'BLESILDA', 'PANGILINAN', '0929-190-1028', '#15 5TH ST. MARIA LOURDES CUPANG', '172.16.252.159', '984562CAE3DA', '1151', '', '', '', '', 'GPON0/3:18', '1250', '07/02/2020', '2020-07-02', 'NEW INSTALL CABLE INTERNET', 'JEFF/ERICK', '02/24/2022', '02/24/2022', '', 'TRANSFER AREA CUPANG TO CUPANG 01/20/2022'),
(309, 1, 'VILLANUEVA', 'CHRISTOPHER', 'DIZON', '0931-101-3650', 'GARNET ST. STA.MARIA VILLAGE TENEJERO', '172.16.2.118', '\n984562C942DC', '268207492', '', '', '26', '3', 'GPON0/8:21', '1250', '07/02/2020', '2020-07-02', 'NEW INSTALL CABLE INTERNET', 'JAYSON/MAC', '', '', '', ''),
(310, 1, 'BRGY. HALL CATANING', 'BRGY. HALL CATANING', 'BRGY. HALL CATANING', '0930-508-6201', 'LOTE BANZON ST. CATANING', '172.16.254.34', '984562C94192', '268207459', '', '', '27', '2', 'GPON 1', '1500', '07/02/2020', '2020-07-02', 'NEW INSTALL INTERNET ONLY', 'ROMER/RONNIE', '', '', '', ''),
(311, 1, 'BAUN', 'RESTLIE', 'SANCHEZ', '0932-231-8693', 'LOT 3 BLK 4 EMERALD ST. STA.MARIA SUBD. TENEJERO', '172.16.254.30', '984562C93E0E', '268207369', '', '', '26', '3', 'GPON 8', '1500', '07/02/2020', '2020-07-02', 'TRANSFER TO FIBER', 'JAYSON/MAC', '01/26/2021', '02/03/2021', '', ''),
(312, 1, 'SUMDIAM', 'MA.ANDREA', 'SALVACION', '0921-415-7299', 'DIAMOND ST. STA. MARIA VILLAGE TENEJERO', '172.16.254.24', '984562C9132A', '268206271', '', '', '26', '3', 'GPON 8', '1500', '07/02/2020', '2020-07-02', 'NEW INSTALL CABLE INTERNET', 'JAYSON/MAC', '', '', '', ''),
(313, 1, 'ZABALA', 'LEONARDO', 'VASQUEZ', '0917-803-1129/237-4333', '726-Z MALUYA RD. CENTRAL', '172.16.5.236', '984562C94B1A', '268207703', '', '', '40', '2', 'GPON 14', '1500', '07/03/2020', '2020-07-03', 'NEW INSTAL CABLE INTERNET', 'JEFF/ERIC', '12/28/2021', '01/05/2022', '', ''),
(314, 1, 'SANTOS', 'DANILO', 'ARCEO', '0907-660-7554', '#476 CATLEYA ST. DFS', '172.16.254.4', '984562C94B60', '268207710', '', '', '2', '1', 'GPON 2', '1500', '07/03/2020', '2020-07-03', 'NEW INSTALL INTERNET ONLY', 'ROMER/RONNIE', '11/25/2021', '11/26/2021', '', ''),
(315, 1, 'GALVEZ', 'GRENDEL', 'DE GUZMAN', '0907-989-7678', '#1214 DIAMOND ST. TAGLESVILLE SAN JOSE', '172.16.3.14', '984562C8C2A8', '268204210', '', '', '17', '3', 'GPON 14', '1500', '07/03/2020', '2020-07-03', 'NEW INSTALL INTERNET ONLY', 'JAYSON/MAC', '', '', '', ''),
(316, 1, 'DE LUNA', 'LIGAYA', 'BAGTAS', '0912-348-8108', 'OWEN CESAR APT. #4 SAMPAGUITA ST. DFS', '172.16.0.176', '984562C94B42', '268207707', '', '', '1', '1', 'GPON 1', '1250', '07/03/2020', '2020-07-03', 'TRANSFER TO FIBER', 'ROMER/RONNIE', '11/25/2021', '11/25/2021', '', ''),
(317, 1, 'VASQUEZ', 'RAFAEL', 'DELA ROSA', '0949-359-4135', '#415 EVERLASTING ST. SAN JOSE', '172.16.254.12', '984562C93350', '268207094', '', '', '12', '3', 'GPON 9', '1500', '07/03/2020', '2020-07-03', 'NEW INSTALL INTERNET ONLY', 'AIRON/OCA/ROAN', '', '', '', 'OLD NAME : ERLINDA VASQUEZ'),
(318, 1, 'REYES', 'JASMINE', 'VALENTOS', '0949-788-4192', '#700 ATIS ST. DFS', '172.16.254.11', '984562C8DA5E', '268204817', '', '', '1', '1', 'GPON0/1:36', '1500', '07/03/2020', '2020-07-03', 'NEW INSTALL INTERNET ONLY', 'ROMER/RONNIE', '', '', '', ''),
(319, 1, 'HULIGANGA', 'JULIE', 'TIMBANG', '0915-584-6178', '#5 SAN VICENTE ST. CUPANG PROPER', '172.16.254.10', '984562C94B6A', '268207711', '', '', '33', '2', 'GPON 7', '1500', '07/03/2020', '2020-07-03', 'TRANSFER TO FIBER - DISCONNECT CABLE', 'JEFF/ERIC', '', '', '', ''),
(320, 1, 'SAINT', 'JOSEPH', 'CDC', '0917-102-0225', '#687 MACOPA ST. DFS', '172.16.254.8', '984562C94A48', '268207682', '', '', '3', '1', 'GPON 3', '1500', '07/03/2020', '2020-07-03', 'NEW INSTALL INTERNET ONLY', 'ROMER/RONNIE', '', '', '', ''),
(321, 1, 'TAJONERA', 'MERLITA', 'GALURA', '0999-667-3336', 'DREAMLAND ST. DONA MARIA TENEJERO', '172.16.254.7', '984562C94B56', '268207709', '', '', '22', '3', 'GPON 4', '1500', '07/03/2020', '2020-07-03', 'TRANSFER TO FIBER', 'JAYSON/MAC', '', '', '', ''),
(322, 1, 'MONTA', 'MILAGROS', 'MARIANO', '0921-753-5676', '#73 DON ANTONIO ST. VILLA LINA TENEJERO', '172.16.2.149', '984562C90F2E', '268206169', '', '', '25', '3', 'GPON 7', '1500', '07/03/2020', '2020-07-03', 'TRANSFER TO FIBER - DISCONNECT CABLE', 'AIRON/OCA/ROAN', '', '', '', ''),
(323, 1, 'LACSA', 'PAULINE', 'PANALIGAN', '0999-686-8003', 'BLK 7 LOT 7 DON EULALIO ST. VILLA LINA TENEJERO', '172.16.254.3', '984562C93B2A', '268207295', '', '', '22', '3', 'GPON 4', '1250', '07/03/2020', '2020-07-03', 'EXISTING CABLE UPGRADE TO FIBER', 'JAYSON/MAC', '', '', '', ''),
(324, 1, 'REYES', 'MARIA VICTORIA', 'M.', '0977-931-6493', '169 MASIKAP ST. CUPANG WEST', '172.16.1.77', '984562C92752', '268206787', '', '', '30', '2', 'GPON 4', '1500', '07/03/2020', '2020-07-03', 'TRANSFER TO FIBER', 'AIRON/OCA/ROAN', '', '', '', ''),
(325, 1, 'CANETE', 'AVITO', 'PILOSOPO', '0920-814-7550', '#48 PHASE 3 TALISAY', '172.16.1.44', '984562C94AD4', '268207696', '', '', '7', '1', 'GPON 7', '1500', '07/04/2020', '2020-07-04', 'NEW INSTALL CABLE INTERMET', 'ROMER/RONNIE', '09/30/2021', '09/30/2021', '', ''),
(326, 1, 'VELASCO', 'BIEN JEROME', 'GONZALES', '0918-419-9747', 'BLK 11 LOT 11 PHASE 2 DON EULALIO ST. VILLA LINA, TENEJERO', '172.16.5.44', '984562C8C51E', '268204273', '', '', '24', '3', 'GPON 6', '1500', '07/04/2020', '2020-07-04', 'NEW INSTALL CABLE INTERNET', 'AIRON/OCA', '06/26/2021', '07/01/2021', '', ''),
(327, 1, 'RAMIREZ', 'ERLYN HAZEL', 'BARTOLOME', '0995-657-0855', '#597 BANZON ST. CENTRAL CUPANG', '172.16.1.102', '984562C9263A', '268206759', '', '', '40', '2', 'GPON 14', '1500', '07/04/2020', '2020-07-04', 'NEW INSTALL CABLE INTERNET', 'ERIC/JOEY/JEFF', '', '', '', ''),
(328, 1, 'BALINGIT', 'JESSIE CHRISTOPHER', 'SERVERA', '0995-817-7812', '#1068 EMERALD ST. TAGLESVILLE SAN JOSE', '172.16.1.109', '984562C8DCE8', '268204882', 'NAP 1 / SLOT 6', 'NAP 1 / SLOT 6', '16', '3', 'GPON0/13:25', '1500', '07/04/2020', '2020-07-04', 'NEW INSTALL CABLE INTERNET', 'JEFF/ERICK/JOEY', '04/25/2022', '04/25/2022', '', 'TRANSFER AREA CUPANG TO SAN JOSE 06/30/2021'),
(329, 1, 'DE GUZMAN', 'JHONAS', 'SANTOS', '0910-855-2857', 'DONA MARIA SUBD. TENEJERO', '172.16.167.8', '984562C8FFE8', '268205778', '', '', '22', '3', 'GPON 4', '1500', '07/04/2020', '2020-07-04', 'NEW INSTALL CABLE INTERNET', 'JAYSON/MAC', '', '', '', ''),
(330, 1, 'DIZON', 'RICARDO', 'PALMERA', '0928-799-5973', '#152 CUADERNO ST. DFS', '172.16.5.49', '984562C90C40', '268206094', '', '', '1', '1', 'GPON 1', '1500', '07/04/2020', '2020-07-04', 'NEW INSTALL CABLE INTERNET', 'ROMER/RONNIE', '07/27/2021', '07/27/2021', '', ''),
(331, 1, 'LOPEZ', 'JAKE', 'SALAZAR', '0998-538-0623', '#10 DON ANOTONIO ST. VILLA LINA TENEJERO', '172.16.178.137', '984562C8E9B8', '2682205210', '', '', '25', '3', 'GPON 7', '1500', '07/04/2020', '2020-07-04', 'NEW INSTALL CABLE INTERNET', 'AIRON/OCA', '05/25/2022', '05/25/2022', '', ''),
(332, 1, 'PINEDA', 'WILMA', 'SABINO', '0915-185-2588', '#1016 JEREMIAH ST. SAN JOSE', '172.16.253.247', '984562C91E56', '268206557', '', '', '15', '3', 'GPON 12', '1400', '07/04/2020', '2020-07-04', 'NEW INSTALL CABLE INTERNET', 'ROMER/RONNIE', '', '', '', ''),
(333, 1, 'CALUZA', 'LOIDA', 'DE JESUS', '0929-276-3225', '#51 DEL CARMER ST. SIBACAN', '172.16.177.192', '984562C8E724', '268205912', '', '', '3', '1', 'GPON 3', '1500', '07/04/2020', '2020-07-04', 'NEW INSTALL INTERNET ONLY', 'AIRON/OCA/ROAN', '', '', '', ''),
(334, 1, 'SEVILLA', 'MARIANNE', 'ORTEGA', '0945-210-0084', '#547 DOLLAR ST. HILLCREST VILLAGE CATANING', '172.16.253.245', '984562C91168', '268206226', '', '', '28', '2', 'GPON 2', '1500', '07/04/2020', '2020-07-04', 'NEW INSTALL INTERNET ONLY', 'JAYSON/MAC', '', '', '', ''),
(335, 1, 'SAZON', 'MILDRED', 'LOPEZ', '0999-675-1626', '#421 ADELFA ST. SAN JOSE', '172.16.253.244 / 172.16.3.152', '984562C94A3E', '268207681', '', '', '12', '3', 'GPON 9', '1500', '07/04/2020', '2020-07-04', 'TRANSFER TO FIBER', 'ROMER/RONNIE', '03/26/2021', '03/31/2021', '', ''),
(336, 1, 'MANALAYSAY', 'JOHN PAUL', 'JERIIO', '0948-073-0250', 'SAN JUAN ST. SIBACAN', '172.16.253.243', '984562C90524', '268205912', '', '', '3', '1', 'GPON 3', '1500', '07/04/2020', '2020-07-04', 'NEW INSTALL INTERNET ONLY', 'OCA/AIRON/ROAN', '', '', '', ''),
(337, 1, 'CABICO', 'SOLEDAD', 'LOPEZ', '0948-792-5695', 'MAUNLAD ST. CUPANG WEST', '172.16.253.242', '984562C8BA24', '268203992', '', '', '30', '2', 'GPON0/4:24', '1250', '07/04/2020', '2020-07-04', 'ADD. INTERNET / NEW INSTALL FIBER INTERNET', 'JEFF/ERICK/JOEY', '', '', '', ''),
(338, 1, 'DANTES', 'LOUIE', 'DE CELLO', '0933-813-7095', '#22 M.H DEL PILAR ST. CUPANG PROPER', '172.16.253.241', ' 984562C908A8\n', '268206002', 'NAP 8 / SLOT 3', 'NAP 8 / SLOT 3', '31', '2', 'GPON 5', '1500', '07/04/2020', '2020-07-04', 'TRANSFER TO FIBER - DISCONNECT CABLE 08/19/2021', 'JEFF/ERICK/JOEY', '', '', '', ''),
(339, 1, 'BANZON', 'ANNA FATIMA', 'TEJADA', '0995-502-0285', '#560 CAMIA ST. DFS', '172.16.1.138', '984562C90DD0\n', '268206134', '', '', '4', '1', 'GPON0/4:12', '1750', '07/06/2020', '2020-07-06', 'EXISTING CABLE UPGRADE TO FIBER', 'AIRON/CRIS', '', '', '', 'DOUBLE THE BANDWIDTH'),
(340, 1, 'PAGUIO', 'OLIVER JUSTIN', 'SALONGA', '0939-393-0836', 'PHASE 1 # 3 SILVERLAND HOMES CUPANG', '172.16.253.239', '984562C914F6', '268206317', '', '', '37', '2', 'GPON 11', '1500', '07/06/2020', '2020-07-06', 'NEW INSTALL CABLE INTERNET', 'ROMER/RONNOE', '03/25/2021', '03/29/2021', '', ''),
(341, 1, 'DELA TORRE', 'RODELIO', 'ALONZO', '0933-655-1638', '#37 SANGKA ST. CUPANG', '172.16.253.231', '984562C934B8', '268207130', '', '', '32', '2', 'GPON 6', '1500', '07/06/2020', '2020-07-06', 'NEW INSTALL INTERNET ONLY', 'ROMER/RONNIE', '02/24/2022', '02/25/2022', '', ''),
(342, 1, 'DE JESUS', 'GUIA', 'PARAISO', '0998-553-1034', 'B.O CAMPO TENEJERO', '172.16.253.230', '984562C8D6BC', '268204724', '', '', '26', '3', 'GPON 8', '1500', '07/06/2020', '2020-07-06', 'TRANSFER TO FIBER', 'ROMER/RONNIE', '04/25/2022', '04/25/2022', '', ''),
(343, 1, 'TOLENTINO', 'AYRENE', 'ARANAS', '0909-832-8140', '#80 WAKAS  JAENA ST. CUPANG PROPER', '172.16.253.229', '984562C8C8CA', '268204367', '', '', '34', '4', 'GPON 1', '1500', '07/06/2020', '2020-07-06', 'NEW INSTALL CABLE INTERNET', 'JAYSON/MAC', '', '', '', ''),
